,Product URL,Product Name,Product Price,Rating,Reviews,Description,ASIN,Manufacturer,Product Description
87,https://www.amazon.in/Dyazo-Resistant-Photographers-Compatible-Panasonic/dp/B0BWWD1QQQ/ref=sr_1_88?crid=2M096C61O4MLT&keywords=bags&qid=1692967689&sprefix=ba%2Caps%2C283&sr=8-88,Dyazo Water Resistant Camera Backpack with Extra Front Pocket Photographers Bag with Rain Cover Tripod Holder Compatible for Sony Nikon Canon Panasonic DSLR (Black & Orange),₹799,4.3 out of 5 stars,531,"  Features : Dimensions 14 inch * 11 "" * 5 inches & weight is 700 grams Black & orange outside color with grey interior color comes with padded adjustable dividers Tripod holding strap & Rain cover    The main compartment holds a DSLR camera three to five standard lenses, plus additional camera equipment. The inside dividers can be adjusted to accommodate diffrent sizes of camera equipment thanks to the detachable padded dividers    Front pocket To store memory cards, power banks, or tech accessories Featuring a discreet, sleek design, the Dyazo Brand camera backpack is a beautifully crafted bag. the front pocket is roomy enough to fit your additional items    Rubber Feet Special Rain cover pocket & compression straps to hold tripod while boasting a stylish exterior that makes this backpack a showstopper.    Compatible with all type of DSLR SLR Backpack to name a few Nikon canon Sigma Olympus   ",-,-,-
88,https://www.amazon.in/Safari-Swagpack-Backpack-Compartments-Raincover/dp/B09B2633BY/ref=sr_1_89?crid=2M096C61O4MLT&keywords=bags&qid=1692967689&sprefix=ba%2Caps%2C283&sr=8-89,Safari Swagpack 35 Ltrs Large Laptop Backpack With 3 Compartments and Raincover - Blue (SWAGPACK19CBBLU),"₹1,255",3.8 out of 5 stars,497,"  Large multi-compartment backpack with a padded sleeve for laptops, can hold up to 17 inch laptop/notebook    Front storage pocket keeps smaller items neatly organized and easy to access    Mesh pockets on both sides to accommodate your water bottle and umbrella    Mesh Padding on back & shoulder strap to provide comfort & better back support; 1-year International Warranty against manufacturing defects    Age Range Description: Adult; Lining Description: Polyester; Special Features: Lightweight; Closure Type: Zipper   ",-,-,-
89,https://www.amazon.in/Half-Moon-Spacious-Backpack-Compartment/dp/B0C23BYDML/ref=sr_1_90?crid=2M096C61O4MLT&keywords=bags&qid=1692967689&sprefix=ba%2Caps%2C283&sr=8-90,Half Moon Strike 35L Unisex Spacious School/Laptop/College/Office Travel Backpack Bag for Men Women Boys & Girls with 15.6 inch Padded Laptop Compartment & Multiple Pockets,₹699,3.6 out of 5 stars,29,"  Care Instructions: Hand Wash Only    MULTI-FUNCTION COMPARTMENT: HALF MOON backpack features multiple storage compartments and features for additional supplies and accessories as your, iPhone, iPad, pen, keys, wallet, books, clothes, bottle, passport and more.    DURABLE MATERIAL: Superior quality durable ECO Friendly waterproof and anti-scratch polyester and featuring a reinforced bottom to withstand heavy use, perfect for business, travel, school and other outdoor activities    COMFORTABLE DESIGN: Our backpack's ""S"" Curve adjustable, heavily padded shoulder straps and back panel make the backpack comfortable to wear even when loaded with all your gear; Compact:Backpack has a roomy Three compartment, front zipper pockets to hold small accessories, one internal security zippered pocket for valuable items and side pockets for water bottle or umbrella.    Size:18*13*10 inch(L*W*H), Capacity: 35L which is bigger than others of the same style. Good size for school, camping, travel, shopping, hiking, climbing, vintage backpack for men and women.    OTHER FEATURES: Laptop compartment, Internal Organiser(Small Pockets), Strong and durable zippers, Adjustable Shoulder Handles (Straps) , 2 Bottle/Umbrella holders , Padded Handle , Padded Laptop Compartment , Ergonomic Design, Reflector Logo, etc   ",-,-,-
90,https://www.amazon.in/Aristocrat-Unisex-Hiking-Backpack-Black/dp/B07G6RQ1L2/ref=sr_1_91?crid=2M096C61O4MLT&keywords=bags&qid=1692967689&sprefix=ba%2Caps%2C283&sr=8-91,Aristocrat 45 Ltrs Men & Women Backpack (Black),"₹1,465",4.0 out of 5 stars,824,  <br>Capacity: 45 liters<br><br>; <br>Material: Nylon<br><br><br><br> <br>    Special Features: Back Padding; Style Name: Traditional Backpacks; Pocket Description: Utility Pocket; Age Range Description: Adult; Closure Type: Zipper<br><br><br> <br>    Closure Type: Zipper; Special Features: Back Padding; Pocket Description: Utility Pocket; Age Range Description: Adult; Style Name: Traditional Backpacks<br><br> <br>    Water Resistance Level: Water Resistant; Pattern Name: Animal Print; Compartment Description: Not Laptop Compatible; Material Type: Polyester; Warranty Description: 1 Year Manufacturer<br><br> <br>    Warranty Description: 18 Months Warranty <br>   ,-,-,-
91,https://www.amazon.in/Bennett-15-6-inch-College-Repellent-Backpack/dp/B09WZKHSDR/ref=sr_1_92?crid=2M096C61O4MLT&keywords=bags&qid=1692967689&sprefix=ba%2Caps%2C283&sr=8-92,"Bennett Casual Laptop Bag School Bags for Boys Girls 15.6-inch, 25 LTR Office & College bags for Mens Water Repellent Backpack for Men & Women (GREY)",₹512,3.9 out of 5 stars,718,"  ✔ PERFECT SIZE & STORAGE SPACE: One separate laptop compartment hold 15.6 Inch Laptop as well as 15 Inch,14 Inch and 13 Inch Laptop and Tablet. And spacious packing compartment roomy for daily necessities, iPad, charger, binders, books, clothes, stationary, college supplies, notebook, electronic accessories etc. Front pocket keep your wallet, phone, key, mobile etc. Mesh pockets at side for water bottle and compact umbrella make your items organized and easier to find.Ideal book bag backpack for high school boys perfectly.    ✔ COMFY & STURDY: Made from WATER RESISTANT and DURABLE ECO-FRIENDLY nylon fabric with Two PADDED shoulder straps, relieve the stress of shoulder, simple but comfortable back design offer your great back support, making your working, journey and travelling more convenient wherever you go. you can use it such as office bag for men . office bag for women .    ✔ COMPACT AND EASY TO CARRY: Light-weight Carrying and perfect for business traveling or trip, weekend getaways, back to school, outdoor activities and college bag for men etc;    ✔ MULTIPURPOSE & SIZE: 20 x 12.2 x 5.7 Inch, perfect to throw under your seat on an airplane when you are traveling or on business trip. Suitable for back to school college, can be easily stored. Good choose for a business laptop backpack, work backpack, laptop bag for men and women, also will be a good gifts for women, gifts for men, gifts for boyfriend or girlfriend and gift bag for travelers.    ✔ MADE IN INDIA: Bennett Casual Backpack is fully manufactured in India and pass through stringent quality tests and checks.The Bennett casual laptop backpack comes with 6 month warranty.   ", B09WZKHSDR ,"Texcoco Enterprises, 9958166528, Texcoco Enterprises, 9958166528 ","Bennett TexcocoEnterprises,9958166528,TexcocoEnterprises,9958166528 bennettcasualbag Grey 50.8Centimeters 30.99Centimeters 14.48x30.99x50.8cm;459Grams ben_cas_grey No LaptopBackpack TexcocoEnterprises,9958166528 India 459g "
92,https://www.amazon.in/Uppercase-Professional-Backpack-Resistant-Sustainable/dp/B0BWNBQXDZ/ref=sr_1_93?crid=2M096C61O4MLT&keywords=bags&qid=1692967689&sprefix=ba%2Caps%2C283&sr=8-93,"uppercase Apex Professional Laptop Backpack (15.6 Inch) 3x more water resistant sustainable bags with rain proof zippers for Men, Women, Boys and Girls, 750 Days warranty","₹1,800",4.4 out of 5 stars,90,"  Care Instructions: Wipe with Damp Cloth    Handcrafted with care and made up of premium quality robust material    Padded laptop compartment fits up to 15.6"" Laptop, Back padding with Air mesh; Front access pocket for you to easily carry important small items with a bottle holder on the side    Wrinkle free bag and 3x more water resistant with Rainproof zippers; Trolley sleeve to securely place the bags on the luggage; Top Slip In Pocket    GRS certified for sustainability; The GRS (Global Recycled Standard) is intended for use with any product that contains at least 50% Recycled Material (License No. CMPY-158596); 750 days of international warranty   ",-,-,-
93,https://www.amazon.in/Half-Moon-Backpack-Spacious-Multiple/dp/B0C6N3MYL2/ref=sr_1_94?crid=2M096C61O4MLT&keywords=bags&qid=1692967689&sprefix=ba%2Caps%2C283&sr=8-94,Half Moon Aztec 37L School Bag Class 5-12 | College Bagpack for Men/College Back pack for Women | 15.6 inch Laptop Bag for Men/Backpack for Men | Spacious & Multiple Pockets,₹649,3.6 out of 5 stars,240,"  This lightweight and spacious laptop bag with 3 compartments contains a dedicated 360 degree protected laptop compartment (up to 17""), so you can you can transport your tech with peace of mind. A Spacious second compartment for essentials like books and files, and a third compartment for extra items. Also features padded shoulder straps and side pockets for water bottles.    Carry your books and belongings with ease with this comfortable and durable bagpack! Featuring wide, padded, and adjustable shoulder straps and a padded back, this backpack can handle even heavy loads. Made with strong yet lightweight polyester fabric and heavy-duty zippers, it's built to last. Plus, it comes with a rain cover, perfect for those rainy school or college days.    Make a statement on your next trip with our smart and stylish backpack! With a trendy and athletic design, this multipurpose backpack is the perfect combination of style and adventure. Your trips, travel experience cannot get completed without this amazing trekking backpack.    Experience enduring and long-lasting performance with our backpack! Made with highly durable material, this backpack is suitable for all weather conditions, including heavy rains and extreme heat. It not only keeps your belongings safe but also resists damage to itself. So, don't settle for anything less.    FEATURES: 15.6 inch Laptop compartment, Internal Organiser, Strong and durable zippers, Adjustable Shoulder Handles (Straps) , 2 Bottle/Umbrella holders , Padded Handle , Padded Laptop Compartment , Ergonomic Design, etc   ",-,-,-
94,https://www.amazon.in/Murano-Casual-daybackpack-Office-College/dp/B0BX9FLPNX/ref=sr_1_95?crid=2M096C61O4MLT&keywords=bags&qid=1692967689&sprefix=ba%2Caps%2C283&sr=8-95,Murano Louis 10ltr Casual daybackpack/Office & Travel Bag/School Bag/College Bag/Men/Women/Girl/Boy (Orange),₹269,3.1 out of 5 stars,80,"  EXCELLENT QUALITY MATERIAL: This fantastic backpack is made of good-quality polyester, which makes it extremely durable and ideal for long-term use. It has a 10 L capacity.    VERSATILE APPLICATION: A side from travel, it can be used as a weekend bag or a training bag. It's a dependable, sturdy backpack for a quick trip or vacation.    STURDY ZIPPERS AND ADJUSTABLE STRAPS: Straps can be adjusted to the user's needs, & good zippers make it simple to frequently take things out and keep them without causing wear and tear.    ERGONOMIC DESIGN: It has a practical design and looks very sophisticated and classy. It is incredibly convenient to carry on the back, making it perfect for everyday use.   ", B0BX9FLPNX ,"Avon Lifestyle Pvt Ltd, Customer Care Email : customercare@avonlifestyle.com, Customer Care Contact : 9321366003 ","Murano AvonLifestylePvtLtd,CustomerCareEmail:customercare@avonlifestyle.com,CustomerCareContact:9321366003 Louis Orange 40.6Centimeters 25.4Centimeters 43.2x25.4x40.6cm;180Grams AvonLifestylePvtLtd India 180g "
95,https://www.amazon.in/BennettTM-Shoulder-Messenger-Repellent-Charcoal/dp/B09CV24TMK/ref=sr_1_96?crid=2M096C61O4MLT&keywords=bags&qid=1692967689&sprefix=ba%2Caps%2C283&sr=8-96,Bennett™ Mystic Unisex Adult Men's Laptop Bag 15.6 inch Side Shoulder Briefcase Satchel Messenger Business Bags for Men & Women Front Pocket for Laptop Accessories - Black (6 Month Warranty),₹512,4.0 out of 5 stars,6.4K+,"  PREMIUM QUALITY MATERIAL: This laptop computer briefcase is made of high-quality water repellent fabric, and well-made of foam pad inside. The laptop briefcase equipped with a removable shoulder strap and a soft carry handle, you can easily switch the carry way you want.    LIGHTWEIGHT AND MULTIFUNCTIONAL: It provide a removable shoulder strap, can be use as shoulder bag or handbag base on your need; top handle strap, and comes with adjustable strap with. It will be a good partner for your daily use or business trip.    EXCELLENT DETAILS: The laptop bag with exquisite zippers, durable hook of strap and soft handle, which make it more comfortable to carry and use. Ensure a secure and long-lasting usage everyday as office work bag, travel laptop briefcase, business laptop case, college laptop bag.    DIMENSION: External: 16 x 12 x 3 inch; Dimension: 16.5 x 11.5 x 2.5 inch. Suitable for 14-15.6 inch: Dell, Acer, ASUS, Samsung, HP and other brand laptops.(Please allow a little size different because of manual measurement). Great gifts choice for birthday, work anniversary.    BENNETT Warranty: Exchange within (6 months) if you don't like. If any problems, please do not hesitate to contact us. We will provide the best solution for you.   ", B09CV24TMK ,"Texcoco Enterprices, 9958166528, ?Texcoco Enterprices, 9958166528 ","Bennett TexcocoEnterprices,9958166528,?TexcocoEnterprices,9958166528 BEN-BC-BLACK BEN-BC-BLACK 29x39x2cm;449Grams BEN-BC-BLACK laptop LaptopCompart MessengerBag 1 No No Nylon TexcocoEnterprices,9958166528 India 449g "
96,https://www.amazon.in/Lavie-Odiase-Womens-Satchel-Handbag/dp/B08SW9RJ75/ref=sr_1_97?crid=2M096C61O4MLT&keywords=bags&qid=1692967690&sprefix=ba%2Caps%2C283&sr=8-97,Lavie Women's Odiase Medium Satchel Bag | Ladies Purse Handbag,"₹1,099",4.1 out of 5 stars,1.5K+,"  Lavie Odiase hand bag is perfect for the ladies on the go. It is durable, lightweight, and available in multiple trendy colors. Made from premium man-made leather, this hand bag has the latest pebble texture and gold detailing to help you stand out from the crowd.    Odiase hand bag has a top zip closure to keep your essentials in place. The bag has 2 main compartments, 2 slip pockets alongside 1 zip pocket in each compartment, providing plenty space for keeping phone, portable charger, keys, hairbrush, wallet, sunglasses, sanitizer etc. It has thin dual shoulder straps and an adjustable sling belt for multipurpose use.    This hand bag is perfect for women to carry to work or a day party. It can be paired with high waist jeans and a statement top as well as with a ruffled dress. This spacious bag makes a great gift for women who love to accessorize.    Made from high-quality, soft materials, this handbag features a well-stitched inner lining for easy accessibility and storage. Plus, with its clean and trendy design, it's perfect for everyday use    Dimension: 22 cm in length x 10 cm in width x 12 cm in height   ",-,-,-
97,https://www.amazon.in/Half-Moon-Spacious-Backpack-Compartment/dp/B0C23BYDML/ref=sr_1_98?crid=2M096C61O4MLT&keywords=bags&qid=1692967690&sprefix=ba%2Caps%2C283&sr=8-98,Half Moon Strike 35L Unisex Spacious School/Laptop/College/Office Travel Backpack Bag for Men Women Boys & Girls with 15.6 inch Padded Laptop Compartment & Multiple Pockets,₹699,3.6 out of 5 stars,29,"  Care Instructions: Hand Wash Only    MULTI-FUNCTION COMPARTMENT: HALF MOON backpack features multiple storage compartments and features for additional supplies and accessories as your, iPhone, iPad, pen, keys, wallet, books, clothes, bottle, passport and more.    DURABLE MATERIAL: Superior quality durable ECO Friendly waterproof and anti-scratch polyester and featuring a reinforced bottom to withstand heavy use, perfect for business, travel, school and other outdoor activities    COMFORTABLE DESIGN: Our backpack's ""S"" Curve adjustable, heavily padded shoulder straps and back panel make the backpack comfortable to wear even when loaded with all your gear; Compact:Backpack has a roomy Three compartment, front zipper pockets to hold small accessories, one internal security zippered pocket for valuable items and side pockets for water bottle or umbrella.    Size:18*13*10 inch(L*W*H), Capacity: 35L which is bigger than others of the same style. Good size for school, camping, travel, shopping, hiking, climbing, vintage backpack for men and women.    OTHER FEATURES: Laptop compartment, Internal Organiser(Small Pockets), Strong and durable zippers, Adjustable Shoulder Handles (Straps) , 2 Bottle/Umbrella holders , Padded Handle , Padded Laptop Compartment , Ergonomic Design, Reflector Logo, etc   ",-,-,-
98,https://www.amazon.in/Mokobara-Transit-Backpack-Laptop-Sunray/dp/B09V7R98XC/ref=sr_1_99?crid=2M096C61O4MLT&keywords=bags&qid=1692967690&sprefix=ba%2Caps%2C283&sr=8-99,"MOKOBARA The Transit Backpack - 30L Premium Nylon 15.6"" Unisex Laptop Bag With Luggage Sleeve","₹4,999",4.5 out of 5 stars,660,"  Care Instructions: Wipe with Damp Cloth    CRAFTED WITH INDUSTRY BEST PREMIUM MATERIALS: Materials: Vegan leather and nylon fabric, Casing: Soft, Water resistant: Yes    MOST FEATURE RICH BACKPACK: Front bucket pocket: Slip pockets, Zippered pocket, Flat opening tech compartment: Pockets to store all your tech accessories, Padded laptop compartment with lock strap, Fits up to a 15.6"" laptop inTransit Backpack - 30L & 15"" laptop in Transit Backpack - 20L    INDUSTRY BEST FUNCTIONAL BACKPACK: 2 Hidden bottle/umbrella pocket, Luggage sleeve, Silicon grab handle, Padded shoulder straps, Easy length adjustment buckles    MAXED OUT STORAGE: Dimension: Transit Backpack - 30L (48 x 31 x 16 cm), Capacity: 30L    MORE REASONS TO LOVE YOUR MOKOBARA: Warranty type: 12 Months, Care Instruction : Wipe with damp cloth   ",-,-,-
99,https://www.amazon.in/Trajectory-Elegant-15-6-Laptop-Office/dp/B09RK6NCGC/ref=sr_1_100?crid=2M096C61O4MLT&keywords=bags&qid=1692967690&sprefix=ba%2Caps%2C283&sr=8-100,Trajectory 15.6 Inch Vegan Leather Messenger Laptop bag for men in Office for all laptop like Apple MacBook with 2 Years Warranty and Spacious Multiple Compartment with Expandable Bottom Used as Shoulder and Handbag for Men,"₹1,399",4.1 out of 5 stars,503,"  PREMIUM LEATHER: We present you a Messenger bag made from Premium Grade 100% Vegan Leather. This vegan leather comes in dual tone Brown shade tone with grain pattern that is rich in taste and is perfect for men with Class.    PERFECT FIT: This bag is suitable for upto 15.6 inch laptop. You get to store the laptop inside a separate 10mm Thick Padded Laptop Compartment so that you laptop stays safe from sudden shock.    SPACIOUS: With 2 Large Main Compartments, 3 Medium Compartments, Inner Accessories pocket, you get plenty of space to store your day to day office things likes Laptop, books, few clothes, bottle, documents and other small essentials. Moreover, the bag is  Expandable upto additional 30% with its bottom chain giving you more space in the hour of need.    TOP NOTCH CRAFTSMANSHIP: At Trajectory, we train every artisan to a degree of perfection so that you get a bag with fine stitching standards. Moreover, We use Best in Class Antique Style Hardware for providing Classic look and durability to the bag.    QUALITY GUARANTEED: While amazon gives 10 days return policy, we at Trajectory give 30 days return in case of any manufacturing defect. Along with that, we provide 2 years warranty against manufacturing defect. Our Customer support team is happy to serve you, call us.   ",-,-,-
100,https://www.amazon.in/Bagneeds-Synthetic-Leather-Briefcase-Messenger/dp/B0855F8174/ref=sr_1_101?crid=2M096C61O4MLT&keywords=bags&qid=1692967690&sprefix=ba%2Caps%2C283&sr=8-101,Bagneeds Men's Black Synthetic Leather Briefcase Best Laptop Messenger Bag Satchel for Men,₹699,4.1 out of 5 stars,4.6K+,"  Suitable for a short business trip or a quick weekend getaway. Size In inches?17""L*4.5""W*12.4""H. weight: 800grm    Laptop padding? The laptop padding fits 15.6 inch laptop for business travel. Other compartment fits 17inch Laptop. Large capacity and front and interior pockets organization for all your business needs.    Removable, adjustable padded shoulder strap    HIGH QUALITY MATERIAL: Made from Premium and Rich quality PU Leather Fabric with Durable Polyester lining.    PERFECT GIFT :With a mutlipurpose use and a classy distressed Vintage inspired look which never goes out of style , This bag is a great gift idea for Fathers Day , Birthdays , Valentines Day , Christmas, Graduation, Back To College Or Any Occasion Which Calls For A Gift . Makes a great gift for professionals, artists , students and all sorts of officials. The bag can be used as a Leather messenger bag for men and women ,laptop bags briefcase , college bag, meeting bag, gift idea   ",-,-,-
101,https://www.amazon.in/Killer-Backpack-Compartments-Polyester-Waterproof/dp/B07CDD6YS2/ref=sr_1_102?crid=2M096C61O4MLT&keywords=bags&qid=1692967690&sprefix=ba%2Caps%2C283&sr=8-102,KILLER Louis 38L Large Laptop Backpack With 3 Compartments Polyester Trendy Waterproof Travel Backpack,"₹2,067",4.4 out of 5 stars,11.4K+,"  Care Instructions: Hand Wash Only    3 Large Compartments, 1 Easy access front Pocket with organizer section & 2 mesh side pocket<br>    Outer Fabric: Durable PU coated Polyester Fabric, inner abric: Strong PU coated polyester fabtic, Hip Strap : No<br>    Well cushioned Laptop compartment for upto 15.6 inch Laptop and spacious enough to carry for two days cloths<br>    Weight: 800gm; Dimensions: 13.00x18.75x9.50 inches (WxHxD)<br>    Strap Type: Adjustable; Pattern Name: Solid; Closure Type: Zipper; Warranty Description: 1 Year Warranty Against Manufacturing Defects.; Pocket Description: Utility Pocket; Style Name: Casual; Compartment Description: Up To 15 Inches; Water Resistance Level: Waterproof; Age Range Description: Adult<br>   ",-,-,-
102,https://www.amazon.in/FATMUG-Laptop-Bag-Men-Convertible/dp/B084LFS4G1/ref=sr_1_103?crid=2M096C61O4MLT&keywords=bags&qid=1692967690&sprefix=ba%2Caps%2C283&sr=8-103,FATMUG Laptop Bag For Men - Convertible Backpack For Office And Travel (Navy Blue Oxford Fabric),"₹1,699",4.4 out of 5 stars,2.3K+,"  PRACTICAL AND ELEGANT:Made with Oxford Fabric, a stylish laptop bag for daily travel and short trips<br>; Age Range Description: Adult; Style Name: Travel Backpacks; Pocket Description: Utility Pocket; Special Features: Laptop Compartment<br><br>    Compartment Description: Greater Than 17 Inches; Water Resistance Level: Water Resistant<br>   ", B084LFS4G1 ,"Fatmug Designs, Delhi ","FATMUG FatmugDesigns,Delhi 600207SWBGA1 14x42x32cm;320Grams 600207SWBGA1 Laptop LaptopCompartment,MultiplePockets,HandCarryHandle,Convertible,TabletCompartment,Adjustable,PaddedStrap,WaterResistant 1 No No Oxford FatmugDesigns India 320g "
103,https://www.amazon.in/Half-Moon-Maverick-Spacious-Compartment/dp/B0C16VZCK7/ref=sr_1_104?crid=2M096C61O4MLT&keywords=bags&qid=1692967690&sprefix=ba%2Caps%2C283&sr=8-104,"Half Moon Maverick 35L Unisex Spacious School/Laptop/College/Office Travel Backpack Bag for Men Women Boys & Girls with 15.6 inch Padded Laptop Compartment, Multiple Pockets & Rain Cover",₹699,3.0 out of 5 stars,9,"  This backpack has a stunning front design that resembles the look of leather. Its unique texture and finish make it stand out among other backpacks and provide a stylish and sophisticated look.    Despite the backpack's unique look, it is actually made of durable materials that are both lightweight and strong. This ensures that the backpack can withstand daily wear and tear, making it a reliable and long-lasting choice.    It also features a reflector logo, adding an extra touch of sophistication to the overall design. This feature helps increase visibility during low light conditions, making it safe to use during early morning or late evening commutes.    The backpack also features multiple compartments and pockets, including a padded laptop compartment and internal organizer(a lot of small pockets). This allows you to keep your belongings organized and secure while on the go, making it an excellent choice for students, professionals, and travelers alike.    Other Features of the Backpack are: Rain Cover, 15.6 inch Laptop Compartment, Internal Organiser(Small Pockets), Strong and durable zippers, Adjustable Shoulder Handles (Straps) , 2 Bottle/Umbrella holders , Padded Handle , Padded Laptop Compartment , Ergonomic Design, Reflector Logo, etc   ",-,-,-
104,https://www.amazon.in/Wildcraft-Turnaround-Polyester-Laptop-8903340000000/dp/B012D4QWES/ref=sr_1_105?crid=2M096C61O4MLT&keywords=bags&qid=1692967690&sprefix=ba%2Caps%2C283&sr=8-105,Wildcraft Turnaround Polyester 14 inch 27 Ltrs Blue Laptop Bag (8903340000000),"₹1,598",4.3 out of 5 stars,3.3K+,"  Outer Material: Polyester, Color: Blue    Water Resistance: Water resistant; Dimensions: 36 cms x 13 cms x 50 cms (LxWxH)    Number of compartments: 3    Laptop Compatible: Fits up to 15.4 laptop    Light Weight    Note : Laptop compartment has no strap   ",-,-,-
