,Product URL,Product Name,Product Price,Rating,Reviews,Description,ASIN,Manufacturer,Product Description
0,https://www.amazon.in/Skybags-Brat-Black-Casual-Backpack/dp/B08Z1HHHTD/ref=sr_1_1?crid=2M096C61O4MLT&keywords=bags&qid=1692967684&sprefix=ba%2Caps%2C283&sr=8-1,Skybags Brat Black 46 Cms Casual Backpack,₹659,4.1 out of 5 stars,5.5K+,"  Care Instructions: Hand Wash Only    Combination of functional & safety features in stylish design, Soft mesh back with 8 mm foam padded 2 Main Compartment, 1 Slip In Pocket inside the bag, Printed Design, Mesh bottle holder on the side,    Water Resistance Level: Not Water Resistant    Size: 35 x 13 x 46 cms   ",-,-,-
1,https://www.amazon.in/American-Tourister-AMT-SCH-02/dp/B07CJCGM1M/ref=sr_1_2?crid=2M096C61O4MLT&keywords=bags&qid=1692967684&sprefix=ba%2Caps%2C283&sr=8-2,American Tourister Fizz Large Size 32 Ltrs Casual Backpack (BLACK),"₹1,199",4.0 out of 5 stars,55.3K+,"  Laptop Compatibility: No, Strap Type: Adjustable, Trolley Support: No. With Rain Cover : No    Outer Material: Polyester, Color: Black    Water Resistance: Water resistant , not Waterproof    Capacity: 32 liters; Dimensions: 31.5 x 22 x 49.5 Centimeters    Number of Wheels: 0, Number of compartments: 3    Warranty type: Manufacturer; 1 year International warranty valid for 1 year from the original date of    Mesh pockets on both sides to accommodate your sipper or bottle and umbrella    Mesh Padding on back & shoulder strap to provide comfort & better back support   ", B07CJCGM1M ,Samsonite ,"Black-Grey 0.48Kilograms AMTFIZZSCHBAG02-BLACK AMTFIZZSCHBAG02-BLACK Polyester L Backpack Rectangular Polyester Samsonite India SAMSONITESOUTHASIAPVT.LTDGATNO.159TO163,GONDE,TALUKA-IGATPURINASIK422403;TelNo.02553-229700 "
2,https://www.amazon.in/Backpack-Small-Black-Water-Repellant/dp/B088XB5XY8/ref=sr_1_3?crid=2M096C61O4MLT&keywords=bags&qid=1692967684&sprefix=ba%2Caps%2C283&sr=8-3,"Mi Step Out 12 L Mini Backpack (Small Size, Black, Water Repellant)",₹299,4.1 out of 5 stars,9.7K+,"  Made of multi-coated 600D polyester Material ; Water Repellent    Dimension: 26cm x 38cm x 14cm (LxWxH); Weight : 200 grams; Capacity: 12liters    Small Size backpack; Laptop Compatibility: No    This backpack comes with 2 zipper pockets that can house a notebook, gym gear, travel essentials and more    With contra zippers and adjustable straps this light weight backpack is the ideal companion while at the airport or hitting the gym or exploring new city or using it as a carrier for books    6 months limited warranty   ", B088XB5XY8 ,"Korrun India Pvt. Ltd, Plot No.25, P2(4&X), 1st Phase, Bidadi Industrial area, Bangalore-562109, Karnataka ","MI KorrunIndiaPvt.Ltd,PlotNo.25,P2(4&X),1stPhase,BidadiIndustrialarea,Bangalore-562109,Karnataka 25740 26x38x14cm;200Grams 25740 WaterResistent,LightWeight,ErgonomicDesign,Adjustable Backpack No Polyester KorrunIndiaPvt.Ltd India 200g "
3,https://www.amazon.in/Number-Backpack-Compartment-Charging-Organizer/dp/B09VTDMRY7/ref=sr_1_4?crid=2M096C61O4MLT&keywords=bags&qid=1692967684&sprefix=ba%2Caps%2C283&sr=8-4,"FUR JADEN Anti Theft Number Lock Backpack Bag with 15.6 Inch Laptop Compartment, USB Charging Port & Organizer Pocket for Men Women Boys Girls",₹679,4.0 out of 5 stars,5.6K+,  Care Instructions: Wipe with Damp Cloth    Number Lock: This Fur Jaden Anti Theft laptop backpack comes equipped with a Number Lock. This helps keep your laptop and other belongings safe when you need to leave your bag unattended in a public space. The number lock sequence can be changed and customised by your directly.<br>    USB Charging Port: Now charge your devices on the go with your new Fur Jaden backpack without the hassle of carrying a bulk power bank in your pocket/ hand at all times.<br>    Ergonomic Design: This backpack has been designed to ensure equal weight distribution on your shoulders along with padded shoulder straps and breathable air mesh on the back.<br>    Dimension: 42 CM (L) x 30 CM (W) x 18 CM (D). Storage Capacity: 25L. Weight: 600 Grams; Warranty: 1 Year Manufacturer Warranty against Manufacturing Defects<br>    Age Range Description: Adult; Closure Type: Zipper; Lining Description: Polyester<br>   ,-,-,-
4,https://www.amazon.in/TRUE-HUMAN-Anti-Theft-backpack-charging/dp/B09QJ7ZF2Y/ref=sr_1_5?crid=2M096C61O4MLT&keywords=bags&qid=1692967684&sprefix=ba%2Caps%2C283&sr=8-5,TRUE HUMAN EMPEROR® Anti-Theft backpack With USB charging Port Laptop bag/Office bag/college bag/travel bag with anti -theft back pocket (LEGEND),₹599,3.7 out of 5 stars,2.4K+,"  Care Instructions: Hand Wash Only    Ease of Access-Multi purpose pockets Super sorted stuff It has a vibrant and stylish design, along with the added benefit of spacious interiors.    Anti - Theft Pocket-Hidden storage pocket for important documents like passports, tickets, cash while on the go.    Integrated Fast charging port-Unique pre-fitted USB port helps you to easily connect your phone or any other device with your power bank. Charging system for smart devices , with free USB (power bank not included )    Care Instructions: Wipe with Dry Cloth    Superior & Durability: Made of durable and Eco-friendly water resistant oxford textile fabric,which keeps your files and stuffs dry inside. This backpack can hold up to 15.6"" laptop from most brands, but it may not be suitable for all brand 15.6"". Since there maybe exist slight size difference among different laptop brands.   ",-,-,-
5,https://www.amazon.in/Half-Moon-Waterproof-Backpack-Students/dp/B085MHDJ93/ref=sr_1_6?crid=2M096C61O4MLT&keywords=bags&qid=1692967684&sprefix=ba%2Caps%2C283&sr=8-6,"Half Moon 35 Ltrs Water Resistant 15.6 inch Laptop Bag for Men/Backpack for Men, Navy Blue | Office Bag for Men/Office Bag for Women with Padded Laptop Compartment | Rain Cover & Reflective Strips",₹649,3.9 out of 5 stars,17K+,"  Care Instructions: Hand Wash Only    SPACIOUS AND LIGHTWEIGHT: Light weight & spacious laptop bag for men comes with 3 compartments. One is for carrying laptop inside (Upto 17""), with padding for safety, and space for laptop accessories like charger, etc. Second compartment of office bag for men is for books, files & all your day to day essentials. And third compartment of backpack for men is for your extra stuff. Laptop backpacks for men has provision for holding bottles on both sides & has padded shoulder straps for your comfort    COMFORT WITH QUALITY: This backpack for men has Wide, Padded & Adjustable shoulder straps & Padded Back for comfort in carrying heavy items. The laptop bag for men is stitched properly & Bartacks on every pressure point for extra durability. The office bag for men are made with strong yet light weight polyester fabric with heavy zippers. College Bags for men also comes with a Rain cover so that you can travel during rainy season without any problem. This laptop bag can be used by everyone.    SMART & TRENDY LOOKS: This Large backpack for men is smart, trendy and stylish in looks. The multipurpose college bags for men looks smart, athletic and venturesome and the blend of grey and red makes it appear exquisite. Your hiking trips, mountaineering experience cannot get completed without this amazing trekking backpack. PREMIUM FABRIC : Premium Polyester, Stylish and durable backpack for school /college and travel. Easily accommodate a laptop. Size: 45 cm X 31 cm X 22 cm    ENDURING & LONG LASTING LAPTOP BACKPACK: This trekking backpack for men/laptop bag for men is made up of highly durable material, which makes it suitable for all weather conditions including rains & extreme scorching heat. It will not only keep the inside stuff safe but will also resist damage to itself. We have designed the bag keeping your comfort in mind. Shoulder has high density padding, with 3D ventilated air foam padding to prevent sweating & to help you lift heavy objects easily.    OTHER FEATURES OF LAPTOP BAG FOR MEN: The office bag for men / office bag for women has Strong and durable zippers, Adjustable Shoulder Handles (Straps) , 2 Bottle/Umbrella holders , Padded Handle , Padded Laptop Compartment (can carry laptops of size 13, 14, 15.6 & 17 inches), Reflector Logo.   ",-,-,-
6,https://www.amazon.in/FUR-JADEN-Leatherette-Polypropylene-DUFF05/dp/B07M9BRCQ5/ref=sr_1_7?crid=2M096C61O4MLT&keywords=bags&qid=1692967684&sprefix=ba%2Caps%2C283&sr=8-7,Fur Jaden Brown Textured Leatherette Stylish & Spacious Weekender Duffle Bag for Travel,₹899,4.3 out of 5 stars,6.5K+,"  MATERIAL - We use of Artificial Leather which is Durable, Long Lasting and tested to ensure they don't peel off in just few months. The leather is also water resistant. Inner fabric lining ensured to have a soft touch feel. We use quality zips and accessories that have a long life.    Waterproof - With this unisex duffle bag, you can be rest assured that none of your belongings will be damaged by rain or accidental splashes. The interiors of this water-resistant travel duffle bag remain free from moisture even if you get caught in an unexpected shower.    Dimensions: 47 x 28 x 27 CM. Volume Capacity - 35 Litres. Huge Spacious Compartment    Design - This stylish yet utilitarian textured leatherette duffle bag can be used for corporate travel as well as to take to the gym. The Large Spacious Compartment is suitable for 3-4 days weekender or business trip, can be used as a carry-on flight bag as well.    Warranty - Fur Jaden Men Bags, 10 days No Question asked replacement guarantee from the date of delivery. 6 Month Manufacturer and Seller Warranty against Manufacturing Defects    Warranty - 100% Genuine Fur Jaden Men Bags, 10 days No Question asked replacement guarantee from the date of delivery. 6 Month Manufacturer and Seller Warranty against Manufacturing Defects   ",-,-,-
7,https://www.amazon.in/Lenovo-15-6-Inches-Everyday-Backpack/dp/B08R7RPVJF/ref=sr_1_8?crid=2M096C61O4MLT&keywords=bags&qid=1692967684&sprefix=ba%2Caps%2C283&sr=8-8,"Lenovo 15.6"" (39.62cm) Slim Everyday Backpack, Made in India, Compact, Water-resistant, Organized storage:Laptop sleeve,tablet pocket,front workstation,2-side pockets,Padded adjustable shoulder straps",₹839,4.3 out of 5 stars,4.2K+,"  Slim, compact & sturdy: Minimal and compact design for professionals: Joint material design, durable, water-resistant polyester material. The padded shoulder straps, handle, and back panel provides protection and all-day comfort    Smooth zippers that never jam or break    Style meets Function: Minimal & compact design, stores and protects laptops up to 15.6-inches. Ideal for students and professionals looking for a stylish and compact backpack for daily use    Spacious storage with easy organization: Inside, you'll find a laptop sleeve, a tablet pocket, a roomy front workstation, and two side pockets for quick access to your other essentials    The padded shoulder straps, handle, and back panel provides protection and all-day comfort.   ", B08R7RPVJF ,"Lenovo, #43/3, Maruthi Mandira, Arisina Kunta, Next to Holiday Plam Hotel, Nelamangala, Bangalore 562123, India ","Lenovo Lenovo,#43/3,MaruthiMandira,ArisinaKunta,NexttoHolidayPlamHotel,Nelamangala,Bangalore562123,India SlimEverydayBackpack Blue 43.5Centimeters 12.5Centimeters 15.6Inches 32x12.5x43.5cm;480Grams GX41B33568 Backpack,warrantyCard Lenovo India 480g "
8,https://www.amazon.in/Half-Moon-Backpack-Luggage-Compartment/dp/B09VCLZ3K4/ref=sr_1_9?crid=2M096C61O4MLT&keywords=bags&qid=1692967684&sprefix=ba%2Caps%2C283&sr=8-9,Half Moon Large 37L Laptop Bag Backpack for menं Women Boys and Girls Luggage Travel Bags with 17.3 inches Laptop Compartment & Rain Cover,₹849,3.9 out of 5 stars,3.4K+,"  This lightweight and spacious laptop bag with 3 compartments contains a dedicated 360 degree protected laptop compartment (up to 17""), so you can you can transport your tech with peace of mind. A Spacious second compartment for essentials like books and files, and a third compartment for extra items. Also features padded shoulder straps and side pockets for water bottles.    Carry your books and belongings with ease with this comfortable and durable bagpack! Featuring wide, padded, and adjustable shoulder straps and a padded back, this backpack can handle even heavy loads. Made with strong yet lightweight polyester fabric and heavy-duty zippers, it's built to last. Plus, it comes with a rain cover, perfect for those rainy school or college days.    Make a statement on your next trip with our smart and stylish backpack! With a trendy and athletic design, this multipurpose backpack is the perfect combination of style and adventure. Your trips, travel experience cannot get completed without this amazing trekking backpack.    Experience enduring and long-lasting performance with our backpack! Made with highly durable material, this backpack is suitable for all weather conditions, including heavy rains and extreme heat. It not only keeps your belongings safe but also resists damage to itself. So, don't settle for anything less.    FEATURES: Rain Cover, upto 17 inch Laptop compartment, Internal Organiser(Small Pockets), Strong and durable zippers, Adjustable Shoulder Handles (Straps) , 2 Bottle/Umbrella holders , Padded Handle , Padded Laptop Compartment , Ergonomic Design, Reflector Logo, etc   ",-,-,-
9,https://www.amazon.in/Police-Polyester-laptop-casual-backpack/dp/B09CQ5T3LN/ref=sr_1_10?crid=2M096C61O4MLT&keywords=bags&qid=1692967684&sprefix=ba%2Caps%2C283&sr=8-10,POLICE Backpack for Men Casual Laptop Bag Office/Travel/College 30 Ltr Hedge Polyester - Black,"₹1,399",4.1 out of 5 stars,5.8K+,  Care Instructions: Hand Wash Only    Backpack   ,-,-,-
10,https://www.amazon.in/Half-Moon-Resistant-Backpack-Compartment/dp/B0BJ32LQ6X/ref=sr_1_11?crid=2M096C61O4MLT&keywords=bags&qid=1692967684&sprefix=ba%2Caps%2C283&sr=8-11,Half Moon Large 37L Laptop Bag Backpack for menं Women Boys and Girls Luggage Travel Bags with 17.3 inches Laptop Compartment & Rain Cover,₹849,3.9 out of 5 stars,3.4K+,"  Care Instructions: Hand Wash Only    This lightweight and spacious laptop bag with 3 compartments contains a dedicated 360 degree protected laptop compartment (up to 17""), so you can you can transport your tech with peace of mind. A Spacious second compartment for essentials like books and files, and a third compartment for extra items. Also features padded shoulder straps and side pockets for water bottles.    Carry your books and belongings with ease with this comfortable and durable bagpack! Featuring wide, padded, and adjustable shoulder straps and a padded back, this backpack can handle even heavy loads. Made with strong yet lightweight polyester fabric and heavy-duty zippers, it's built to last. Plus, it comes with a rain cover, perfect for those rainy school or college days.    Make a statement on your next trip with our smart and stylish backpack! With a trendy and athletic design, this multipurpose backpack is the perfect combination of style and adventure. Your trips, travel experience cannot get completed without this amazing trekking backpack.    Experience enduring and long-lasting performance with our backpack! Made with highly durable material, this backpack is suitable for all weather conditions, including heavy rains and extreme heat. It not only keeps your belongings safe but also resists damage to itself. So, don't settle for anything less.    FEATURES: Rain Cover, upto 17 inch Laptop compartment, Internal Organiser(Small Pockets), Strong and durable zippers, Adjustable Shoulder Handles (Straps) , 2 Bottle/Umbrella holders , Padded Handle , Padded Laptop Compartment , Ergonomic Design, Reflector Logo, etc   ",-,-,-
11,https://www.amazon.in/Rucksack-Travel-Backpack-Trekking-Compartment/dp/B07YDGQQN5/ref=sr_1_12?crid=2M096C61O4MLT&keywords=bags&qid=1692967684&sprefix=ba%2Caps%2C283&sr=8-12,"Fur Jaden 55 LTR Rucksack Travel Backpack Bag for Trekking, Hiking with Shoe Compartment",₹849,4.3 out of 5 stars,5.6K+,  Large sized black and grey colour trekking rucksack for men and women for travel use as well as for trendy college and school students. Huge compartment size that can fit upto several pairs of clothes with ease with separate pocket for shoesMultiple pockets for other accessories and water bottle<br>    External clips to hold a yoga mat on the backside available with this rucksack. Also available on both sides of the rucksack are additional clips which can be used to carry camera stands as well as other climbing equipments<br>    The rucksack features a sleek and ergonomic design with a balanced weight distribution through its shoulder straps and waist strapsThis makes this product a suitable alternative to bulky and unsightly rucksacksThe compact design of this trekking bag helps you to rest it comfortably on your shoulders while accommodating all your essentials with ease<br>    Capacity: 55 L ; weight: 700 grams; dimensions: 35 cms x 25 cms x 65 cms (LxWxH); 1 Year manufacturer warranty against defects; Lining Description: Polyester; Special Features: Back Padding; Pocket Description: Utility Pocket; Style Name: Rucksack Backpacks; Closure Type: Zipper; Age Range Description: Adult; Color Name: Black Grey<br>    Water Resistance Level: Water Resistant; Warranty Description: 1 Year Manufacturer Warranty Against Defects Only<br>   ,-,-,-
12,https://www.amazon.in/Wesley-Milestone-Waterproof-Backpack-Business/dp/B084JGJ8PF/ref=sr_1_13?crid=2M096C61O4MLT&keywords=bags&qid=1692967684&sprefix=ba%2Caps%2C283&sr=8-13,Wesley Milestone 2.0 Casual Waterproof Laptop Backpack/Office Bag/School Bag/College Bag/Business Bag/Travel Backpack (Dimensions:13x18 inches) (Compatible with 39.62cm(15.6inch laptop) 30 L (Blue & black),₹550,4.3 out of 5 stars,12.4K+,"  30L Capacity: The Backpack has a padded laptop compartment that can fit 15.6 inch laptop. It can also accommodate essentials such as a Lunch box, Charger, Tablet, Books, Power Bank, Wallet, and Sunglass.    Multi-Level Organizer: The backpack has a front zipper pocket for the ID card, Sanitizer, House keys, Pen. First compartment with pockets for the earphones, pens, notebook, Fitness Band. Spacious second compartment for all your electronics.    Ergonomic Design: Thick cushioning around the shoulders and on the back panel makes the backpack super light and comfortable on the move. “S” Shaped shoulder strap distribute the weight of the backpack across your upper body.    Made In India: Wesley Business Casual Backpack is fully manufactured in India and pass through stringent quality tests and checks    1 Year Warranty: The Wesley Business casual backpack comes with 1 year of warranty    Water Resistant Material: Advanced IPX4 coating on the material ensures resistance to water entering from any direction.   ", B084JGJ8PF ,"Wesley, Longani Trading Company, F-82, Sector-1, Bawana Industrial Area, Delhi-110039 ","Wesley Wesley,LonganiTradingCompany,F-82,Sector-1,BawanaIndustrialArea,Delhi-110039 Mii-007 Mi-007 31.8x17.8x45.7cm;480Grams Mii-007 LaptopCompartment,Waterproof,Lightweight,ErgonomicDesign,PaddedStrap Backpack 1 15.6Inches No Polyester Wesley India 480g "
13,https://www.amazon.in/Gear-Classic-Leather-Backpack-LBPCLSLTH0201/dp/B07G4F6XFH/ref=sr_1_14?crid=2M096C61O4MLT&keywords=bags&qid=1692967684&sprefix=ba%2Caps%2C283&sr=8-14,Gear Classic 20L Small Size Faux Leather Water Resistant Anti Theft Unisex Laptop Backpack- Brown,₹899,4.4 out of 5 stars,6K+,"  Care Instructions: Hand Wash Only    Outer material: synthetic, color: brown    Waterproof    Capacity: 20 liters; Weight: 560 grams; Dimensions: 48 cms x 32 cms x 14 cms (LxWxH)    Number of compartments: 2    Laptop compatibility: yes, laptop size: 16strap type: adjustable    Anti theft waterproof bag with anti sweat fabric on back and shoulder straps   ",-,-,-
14,https://www.amazon.in/GEAR-Black-Blue-Backpack-years/dp/B019HA8AYG/ref=sr_1_15?crid=2M096C61O4MLT&keywords=bags&qid=1692967684&sprefix=ba%2Caps%2C283&sr=8-15,Gear CarryOn 16L Foldable Water Resistant School Bag//Backpack/College Bag for Men/Women - Blue Black,₹184,3.7 out of 5 stars,7K+,"  Outer Material: Polyester, Color: Black and Yellow.Ideal for 3-5 year old children.    Wear Resistant: Wear resistant, Stain resistant, Water Resistance: Water resistant; Dimensions: 49 cms x 33 cms x 10 cms (LxWxH)    Number of compartments: 1; Compatible Laptop Size : 15.4    Warranty Type: Manufacturer; 1 Year from the date of purchase    Pocket Description: Utility Pocket; Color Name: Black And Blue; Age Range Description: Adult; Closure Type: Zipper   ",-,-,-
15,https://www.amazon.in/Zipline-Nexa-Resistant-Bagpack-Backpack/dp/B08WQ668WJ/ref=sr_1_16?crid=2M096C61O4MLT&keywords=bags&qid=1692967684&sprefix=ba%2Caps%2C283&sr=8-16,Zipline Unisex Casual Polyester 36 L Backpack School Bag Women Men Boys Girls Children Daypack College Bag Book School Sports Bag,₹843,3.6 out of 5 stars,918,"  A super-slim backpack for men design, trendy looks and durable construction - this stylish 36 L backpack from ZIPLINE has got everything that will complement your youthful personality.This college bag has spacious interiors, this unisex backpack is a great option for short road trips, college and work. Ergonomic design of this school bag for boys are crafted from polyester, this medium school bag is sturdy enough to withstand regular wear and tear gracefully.    Zipline laptop bag for men features a cushioned base and internal back padding to offer you extra comfort. The padded shoulder straps of this school bag for boys can be easily adjusted according to your liking. Spacious backpack is featuring with four pockets and three main compartments all with speciality zippers, this office bag for men offers you enough space to carry your books, files, travel accessories, stationery, keys and mobile accessories. It comes with the ZIPLINE promise of quality.    The lighter your college Bag, the more you’ll enjoy hiking. With this in mind, we've ensured that the Zipline college bag weighs very light, and does not add extra weight to your back.    The Zipline school bag has been provided with a bouncy mesh that prevents sweatiness by allowing air flow. The padded back panel of this school bag and shoulder straps helps make carrying heavier loads easier and more comfortable.    Highly Durable and Water Resistant fabric have been used in this school bag for boys   ",-,-,-
16,https://www.amazon.in/SFANE-Duffel-Shoulder-Women-Compartment/dp/B07XXFB9CZ/ref=sr_1_17?crid=2M096C61O4MLT&keywords=bags&qid=1692967685&sprefix=ba%2Caps%2C283&sr=8-17,Sfane Polyester 23cms Duffle/Shoulder/Gym Bag for Men & Women with Separate Shoe Compartment (Grey),₹387,4.3 out of 5 stars,7.9K+,"  Premium Durable Material - Travel duffel bag is made of high quality,durable material.    Separate Shoes Compartment - Built-in extra shoes compartment with exterior zippers to keep your shoes and clean sport gears separate.    Multi-Purpose & Any Occasions - Perfect Duffle Bag for hiking, family holiday, vacation, sports, a short trip, gym, work, beach, used as a overnight bag, a short journey bag, a weekender bag, gym bag, sports duffel bag.    Adjustable Shoulder straps - Comfortable and adjustable shoulder strap    Abundance of Storage - Large capacity,meet your requirement for sure and keep your stuff in order. What an amazing design for Sport Bag!   ",-,-,-
17,https://www.amazon.in/ADISA-Laptop-Backpack-Office-College/dp/B09TPX22NF/ref=sr_1_18?crid=2M096C61O4MLT&keywords=bags&qid=1692967685&sprefix=ba%2Caps%2C283&sr=8-18,ADISA 15.6 inch laptop backpack office bag college travel back pack 32 Ltrs,₹499,3.9 out of 5 stars,1.1K+,  Care Instructions: Wipe with Damp Cloth    Material: Water Resistant Light-Weight Polyester<br>    Compartments: 2 with padding; Laptop Size: 15.6 inch and below<br>    Dimensions: LxWxH - 12.5 x 7.5 x 19 inches<br>    Reflector Logo / Adjustable Padded Shoulder Straps / 2 Bottle holders<br>    Closure Type: Zipper<br>   ,-,-,-
18,https://www.amazon.in/Half-Moon-Backpack-Spacious-Multiple/dp/B0C23Z9W18/ref=sr_1_19?crid=2M096C61O4MLT&keywords=bags&qid=1692967685&sprefix=ba%2Caps%2C283&sr=8-19,Half Moon Aztec 37L School Bag Class 5-12 | College Bagpack for Men/College Back pack for Women | 15.6 inch Laptop Bag for Men/Backpack for Men | Spacious & Multiple Pockets,₹649,3.6 out of 5 stars,240,"  This lightweight and spacious laptop bag with 3 compartments contains a dedicated 360 degree protected laptop compartment (up to 17""), so you can you can transport your tech with peace of mind. A Spacious second compartment for essentials like books and files, and a third compartment for extra items. Also features padded shoulder straps and side pockets for water bottles.    Carry your books and belongings with ease with this comfortable and durable bagpack! Featuring wide, padded, and adjustable shoulder straps and a padded back, this backpack can handle even heavy loads. Made with strong yet lightweight polyester fabric and heavy-duty zippers, it's built to last. Plus, it comes with a rain cover, perfect for those rainy school or college days.    Make a statement on your next trip with our smart and stylish backpack! With a trendy and athletic design, this multipurpose backpack is the perfect combination of style and adventure. Your trips, travel experience cannot get completed without this amazing trekking backpack.    Experience enduring and long-lasting performance with our backpack! Made with highly durable material, this backpack is suitable for all weather conditions, including heavy rains and extreme heat. It not only keeps your belongings safe but also resists damage to itself. So, don't settle for anything less.    FEATURES: 15.6 inch Laptop compartment, Internal Organiser, Strong and durable zippers, Adjustable Shoulder Handles (Straps) , 2 Bottle/Umbrella holders , Padded Handle , Padded Laptop Compartment , Ergonomic Design, etc   ",-,-,-
