,Product URL,Product Name,Product Price,Rating,Reviews,Description,ASIN,Manufacturer,Product Description
148,https://www.amazon.in/Kuber-Industries-Avengers-Backpacks-Waterproof/dp/B0BP7JFYDV/ref=sr_1_149?crid=2M096C61O4MLT&keywords=bags&qid=1692967694&sprefix=ba%2Caps%2C283&sr=8-149,Kuber Industries Disney Princess School Bag for Kids|Stylish Backpacks for Kids|Rexine Waterproof Shoulder Straps Bag (Pink),₹664,4.0 out of 5 stars,95,"  ♣ PACKAGE CONTAIN : 1 Piece School Bag|MATERIAL : Rexine|PACKAGE DIMENSION : 40 cm x 28 cm x 18 cm    ♣ LARGE CAPACITY & MORE STORAGE : This School Backpack Will Be An Ideal Gift For Your Little Ones, as You Have Included 3 Large & 1 One Small Compartments And a Small Pocket For Your Child to Keep Some Extra Books in It, The Backpack is Useful in Teaching Your Kids How to Organize Their Things Is. The Front Section Houses a Zipped Compartment for Your Daily Essentials.    ♣ STYLISH & ATTRACTIVE BACKPACK : This Attractive School Bag is Designed Keeping in Mind The Busy School Workload of The Child. It is So Roomy, Trendy And Attractive That Your School Going Kids Would Love to Carry it. The Backpack is Designed in a Form That Would be Really Treasured by Your Kid. This Cute Little Backpack is Lightweight And Your Kid Will Not Feel The Pressure on His Shoulder.    ♣ COMFORTABLE AND STURDY : This Backpack Will Give Your Kids a Comfortable Feel And Its Durability Allows It to Last, The Breathable And Adjustable Shoulder Straps Relieve Shoulder Strain. Foam Padded Top Handle Last Longer. This School Bag Shoulder Strap, Provided With a Breathable, Adjustable Shoulder Strap, Helps Relieve the Back Pressure of The Shoulders.    ♣ GIFT FOR KIDS : This Kids Backpack Bag is Very Attractive Years Old Kids, Girls, Boys. Gives You a Good Feeling All the Time, This Soft, Sleek Bags Can be Tried as a Great Gift for Boys And Girls Gift It to Your Dear Child on Special Occasions. Perfect School Bag It is a Cute Gift for Your Niece, Nephew.   ",-,-,-
149,https://www.amazon.in/DIVULGE-Drawstring-Bag-Sports-Utility/dp/B07PXTDBH4/ref=sr_1_150?crid=2M096C61O4MLT&keywords=bags&qid=1692967694&sprefix=ba%2Caps%2C283&sr=8-150,"DIVULGE Multi Utility Drawstring Bag (Black , 16 L)",₹145,4.0 out of 5 stars,1.1K+,"  Made with coated polyester fabric which makes the backpack Sturdy, durable and highly water resistant and The strings used are stretchable and of premium quality. <br>    Comes with side gussets, ensures extended storage space. <br>    Storage capacity up-to 16 litres.; Dimensions: Width - 12 inches & Height - 18 inches. <br>    Closure type is Drawstring type Which Makes it to Store Things Quickly <br>    Pattern Name: Solid; Age Range Description: Adult <br>   ",-,-,-
150,https://www.amazon.in/ASUS-Backpack-Cross-Dyed-Material-Suitable/dp/B09Q68446F/ref=sr_1_151?crid=2M096C61O4MLT&keywords=bags&qid=1692967694&sprefix=ba%2Caps%2C283&sr=8-151,"ASUS BP4600 Laptop Backpack (Grey), with Cross-dyed Woven Fabric Material, Suitable for up to 40.64 cm (16-inch) Laptop","₹1,199",4.4 out of 5 stars,63,"  Laptop compartment accommodates up to a 16-inch laptop, with a hook-and-loop fastener for security.    Convenient main pockets for charger, mice, pen and power bank make anything organized.    Two flexible side pockets for different size of bottle and umbrella.    Two front pockets for quick-access your essentials.    Durable metal zipper pull tab, Pocket color clash design   ", B09Q68446F ,"ASUS, Korrun India Private Limited. plot no-25,p2,1st phase, Bidadi Industrial Area Ramanagara District,karnataka-562109 Banglore , India ","ASUS ASUS,KorrunIndiaPrivateLimited.plotno-25,p2,1stphase,BidadiIndustrialAreaRamanagaraDistrict,karnataka-562109Banglore,India ASUSBP4600 Grey 5Centimeters 15Centimeters 10x15x5cm;520Grams BP4600 ASUS India 520g "
151,https://www.amazon.in/Skybags-Unisex-Adjustable-Polyester-Backpacks/dp/B0BJ75WR71/ref=sr_1_152?crid=2M096C61O4MLT&keywords=bags&qid=1692967694&sprefix=ba%2Caps%2C283&sr=8-152,Skybags Chase 32L Unisex Adjustable Strap Polyester Red Backpacks,"₹1,152",4.2 out of 5 stars,103,  Care Instructions: Wipe with Dry Cloth    Sporty and Stlyish backpack with 3 compartments    1 front slip in pocket    built to last straps    slip in file compartment    multilevel organizer with key chain holder   ,-,-,-
152,https://www.amazon.in/Lavie-Womens-Ushawu-Satchel-Handbag/dp/B0B3J9J9CK/ref=sr_1_153?crid=2M096C61O4MLT&keywords=bags&qid=1692967694&sprefix=ba%2Caps%2C283&sr=8-153,Lavie Women's Ushawu Satchel Bag | Ladies Purse Handbag,"₹1,099",4.1 out of 5 stars,7K+,"  Ushawu small satchel has a top zip closure to keep your essentials in place. The bag has a main spacious compartment with a divider zip pocket to provide you enough space for keeping phone, portable charger, keys, hairbrush, wallet, sunglasses etc.    Stylish & structured handbag with a compact shape and premium texture.    Features dual round handles, it comes with an adjustable and deatchable sling strap.    A perfect handbag from Lavie which will help you carry with style all your essentials for the day.    It comes in a couple of beautiful shades to fit your preferences and selection.   ",-,-,-
153,https://www.amazon.in/Wildcraft-Black-Casual-Backpack-11652-Black/dp/B079Q79FX5/ref=sr_1_154?crid=2M096C61O4MLT&keywords=bags&qid=1692967694&sprefix=ba%2Caps%2C283&sr=8-154,Wildcraft 31 Ltrs Black Casual Backpack (11652-Black),"₹1,190",4.3 out of 5 stars,371,"  Outer Material: Polyester, Color: Black    Capacity: 31 liters; Dimensions: 8 inches x 13 inches x 18.5 inches (LxWxH)    Number of compartments: 2    Warranty type: Manufacturer; 5 years manufacturer warranty is non-transferable and valid for 5 years from the original date of purchase   ",-,-,-
154,https://www.amazon.in/Genie-Black-School-Backpack-LUSH19SBBLK/dp/B07QHLBBPM/ref=sr_1_155?crid=2M096C61O4MLT&keywords=bags&qid=1692967694&sprefix=ba%2Caps%2C283&sr=8-155,"Genie Lush School Bag for Girls, 19 inch Backpack for Women, 3 compartments Water Resistant Stylish and Trendy College Backpacks for Girls","₹1,104",4.1 out of 5 stars,1.7K+,"  Care Instructions: Hand Wash Only    Outer Material : Nylon Twill Colour : BLACK The backpack is LIGHT WEIGHT yet strong enough to hold your supplies. The superior quality NYLON TWILL material lends a beautiful shine and soft feel to the backpack.; Dimensions (in cms): 48x33x23 cm Capacity: 36 Litres Weight: 665 grams Fully Lined for extra strength WATER RESISTANT : YES Warranty: 12 months manufacturer warranty    NUMBER OF COMPARTMENTS : 3 Spacious compartment to keep your essentials like textbooks, stationary, lunchbox etc. TWO SIDE POCKET : The backpack provides 2 exterior side pocket for holding water bottle,clipping pens or pencil or storing other items.    1 FRONT POCKET : It comes handy in keeping boarding pass tickets, mobile phone, earphone, cards,cash etc. SECRET POCKET : Keep your valuables safe with one additional secret pocket    ERGONOMIC BACK & SHOULDER STRAPS :There is padded back mesh and ergonomic straps that gives extra spine and shoulder support and helps in minimizing the load EASY GRAB PADDED HANDLE for added comfort and convinience to hold the bag.    Pocket Description: Utility Pocket; Special Features: Back Padding; Age Range Description: Kid; Closure Type: Zipper    3 Main Compartment, 1 External Pocket, Back Padded Mesh   ",-,-,-
155,https://www.amazon.in/SPENZ-BAGS-Backpack-Raincover-Baby-Pink/dp/B0C3RNFHHV/ref=sr_1_156?crid=2M096C61O4MLT&keywords=bags&qid=1692967694&sprefix=ba%2Caps%2C283&sr=8-156,"SPENZ BAGS Travel Laptop Backpack for Women & Men|Carry On Bag, College & School Students Bookbag With Raincover",₹845,4.0 out of 5 stars,163,"  Care Instructions: Hand Wash Only    LARGE CAPACITY & MANY POCKETS: This backpack has two main compartment pockets. One separate laptop compartment holds 15.6 Inch Laptop as well as 15 Inch, 14 Inch and 13 Inch Mac book or Laptop. The other one packing compartment is roomy for daily necessities and tech electronics accessories. Front compartment with zipper pocket and 2 elastic mesh side pockets.Make your items organized and easier to find.    COMFY & BREATHABLE BACKPACK: Adjustable shoulder straps and back side comes with comfortable and breathable mesh design, relieves the stress of your shoulder. A comfortable airflow foam-pad back design with soft, multi-panel breathable mesh padding, offer your back maximum back support. A foam-padded top handle for a long time carry on.    HIGH QUALITY MATERIAL: Our backpack made of waterproof and quality Polyester fabric with metal zippers. Lightweight and sturdy, ensure a secure & long-lasting usage every day. Perfects for weekend getaways, shopping, office work, business traveling and other outdoor activities. Also, it is a perfect student’s backpack for women, men, teens, boys and girls.    LAPTOP PROTECTION: Separate laptop compartment with foam padded of this back pack offers the optimal protection for your 15.6 inch laptop. Mesh pockets for mouse, adapter, charging cord and other electronics. Take the worry out of your work and study.    IDEAL GIFT: This fashionable backpack can be a great companion for travel, business, everyday use and outdoor activities. Also, a perfect college high school student backpack for boys, girls, teens. Practical gifts for teens, boys, girls, friends, mother, father, her or him.   ",-,-,-
156,https://www.amazon.in/ZOUK-Handmade-Leather-Handles-Multicolor/dp/B09QRYDXJH/ref=sr_1_157?crid=2M096C61O4MLT&keywords=bags&qid=1692967694&sprefix=ba%2Caps%2C283&sr=8-157,ZOUK Women Laptop Bag Royal Indian Peacock Motif,"₹1,699",4.4 out of 5 stars,154,"  COMPATIBILITY: Our Office Bag is an ideal laptop bag, handbag or a Professional Bag for Women. It can fit a laptop of upto 15.6 inches and is perfect for Macbook, Chromebook, iPad, Tablet, Hp, Lenovo, Dell etc. Dimensions: 16 x 13 x 4 inch    COMPONENTS: On the Inside there is a padded Laptop Sleeve with Velcro, a larger compartment for books, tiffin, chargers. Also there are 2 small pockets for a Wallet, Pen and Keys. The Bag has a Zip Closure and Double Straps for carrying comfortably.    MATERIAL: Made of Fine Indian Print Fabric. The Leather used is 100% PeTA approved Vegan Leather, making it a cruelty-free and a responsible product. All products are handmade, with a running fabric and hence the exact print on the product might slightly differ from the photos.    DISCLAIMER: It is recommended that you regularly clean your bag with a wet cloth. Do note that the colour of the materials might slightly vary due to photographic lighting sources or your display settings.    ABOUT US: Zouk is a Proudly Indian and 100% PeTA approved Vegan brand. Our Laptop Bag stands for Style and Function, with an Essence of India. Couple of our bags were featured in the popular Netflix series Little Things 3. All our bags are handcrafted by expert artisans in our own manufacturing facility.   ",-,-,-
157,https://www.amazon.in/Martucci-Waterproof-Backpack-College-Business/dp/B0B1HM2ZGX/ref=sr_1_158?crid=2M096C61O4MLT&keywords=bags&qid=1692967694&sprefix=ba%2Caps%2C283&sr=8-158,Martucci 16 inch 36L Casual Waterproof Backpack/Office Bag/School Bag/College Bag/Business Bag/Unisex Travel Backpack,₹599,3.8 out of 5 stars,201,"  Care Instructions: Hand Wash Only    MADE OF DURABLE MATERIAL & SOLID : Made of Durable Nylon Fabric with metal zippers. Ensure a secure & long-lasting usage everyday & weekend. Serve you well as professional office work bag.<br><br>    WATER REPELLENT & MULTIPURPOSE : PADDED shoulder Straps offer LIGHT-WEIGHT Carrying, Perfects for business traveling, weekend getaways, shopping, professional office work and other outdoor activities. Also, a perfect college high school student backpack for Boys, girls, teens, women and men.<br><br>    FUNCTIONAL & SAFE : 2 Big Compartments to store more your belongs well and External pocket for Quick access to your basic needs like key, sun glasses and your other valuable items.<br><br>    LOTS OF STORAGE SPACE & POCKETS : One separate Notebook compartment.One spacious packing compartment roomy for daily necessities, Tech electronics accessories. With many pockets make your items organized and easier to find.<br><br>    Lining Description: Polyester; Pattern Name: Self Design; Pocket Description: Utility Pocket; Material Type: Polyester; Color Name: Navy Blue; Age Range Description: Adult; Special Features: Back Padding<br>   ",-,-,-
158,https://www.amazon.in/Storite-Travel-Bag-Lightweight-GreenPink/dp/B0B3JBYZ8C/ref=sr_1_159?crid=2M096C61O4MLT&keywords=bags&qid=1692967694&sprefix=ba%2Caps%2C283&sr=8-159,"Storite Nylon 46 Cm Multi Purpose Travel Duffle Bag for Women with Dry and Wet Separate Pocket, Lightweight Waterproof Backpack Carry Luggage Bag with Shoe Compartment (GreenPink, 46x23x25 cm)","₹1,399",4.2 out of 5 stars,382,"  Closure Type : Zip , Handle Type : Detachable    Strap Type : Two short handles + 1 Shoulder strap handle + 2 padded shoulder handle.; Item dimensions : Height : 23 cm,Width : 25 cm, Length : 46 cm , 26.45 Litrs , Water Resistant Level : Waterproof    Item Dimensions : Height : 24cm, Width : 27 cm, Lenght : 46 cm , 26.45 Litrs ,Water Resistance Level : Waterprooof.   ",-,-,-
159,https://www.amazon.in/Business-Casual-Resistant-Laptop-Backpack/dp/B0862V2GKH/ref=sr_1_160?crid=2M096C61O4MLT&keywords=bags&qid=1692967694&sprefix=ba%2Caps%2C283&sr=8-160,MI Business Casual 21L Water Resistant Laptop Backpack,₹999,4.4 out of 5 stars,1.3K+,"  Care Instructions: Hand Wash Only    21L Capacity: The Backpack has a padded laptop compartment that can fit 15.2 inch laptop. It can also accommodate essentials such as a Lunch box, Charger, Tablet, Books, Power Bank, Wallet, and Sunglass. Dimension(L*W*D): 44*32*16 cm. Material : 100% Polyester. Lining : 100% Polyster    Water Resistant Material: Advanced IPX4 coating on the material ensures resistance to water entering from any direction.    Secret/Hidden Pocket: An invisible zipper pocket on the edge of the back panel acts as a guard for any valuable items such as TWS/ Earbuds, Passport, Phone against theft.    Multi-Level Organizer: The backpack has a front zipper pocket for the ID card, Sanitizer, House keys, Pen. First compartment with pockets for the earphones, pens, notebook, Fitness Band. Spacious second compartment for all your electronics.    Ergonomic Design: Thick cushioning around the shoulders and on the back panel makes the backpack super light and comfortable on the move. “S” Shaped shoulder strap distribute the weight of the backpack across your upper body.    Made In India: Mi Business Casual Backpack is fully manufactured in India and pass through stringent quality tests and checks    6 Months Warranty: The MI Business casual backpack comes with 6 months of warranty. For queries please reach out to 18001036286   ",-,-,-
160,https://www.amazon.in/ZOUK-Handmade-Leather-Handles-Multicolor/dp/B09QRYDXJH/ref=sr_1_161?crid=2M096C61O4MLT&keywords=bags&qid=1692967695&sprefix=ba%2Caps%2C283&sr=8-161,ZOUK Women Laptop Bag Royal Indian Peacock Motif,"₹1,699",4.4 out of 5 stars,154,"  COMPATIBILITY: Our Office Bag is an ideal laptop bag, handbag or a Professional Bag for Women. It can fit a laptop of upto 15.6 inches and is perfect for Macbook, Chromebook, iPad, Tablet, Hp, Lenovo, Dell etc. Dimensions: 16 x 13 x 4 inch    COMPONENTS: On the Inside there is a padded Laptop Sleeve with Velcro, a larger compartment for books, tiffin, chargers. Also there are 2 small pockets for a Wallet, Pen and Keys. The Bag has a Zip Closure and Double Straps for carrying comfortably.    MATERIAL: Made of Fine Indian Print Fabric. The Leather used is 100% PeTA approved Vegan Leather, making it a cruelty-free and a responsible product. All products are handmade, with a running fabric and hence the exact print on the product might slightly differ from the photos.    DISCLAIMER: It is recommended that you regularly clean your bag with a wet cloth. Do note that the colour of the materials might slightly vary due to photographic lighting sources or your display settings.    ABOUT US: Zouk is a Proudly Indian and 100% PeTA approved Vegan brand. Our Laptop Bag stands for Style and Function, with an Essence of India. Couple of our bags were featured in the popular Netflix series Little Things 3. All our bags are handcrafted by expert artisans in our own manufacturing facility.   ",-,-,-
161,https://www.amazon.in/Martucci-Waterproof-Backpack-College-Business/dp/B0B1HM2ZGX/ref=sr_1_162?crid=2M096C61O4MLT&keywords=bags&qid=1692967695&sprefix=ba%2Caps%2C283&sr=8-162,Martucci 16 inch 36L Casual Waterproof Backpack/Office Bag/School Bag/College Bag/Business Bag/Unisex Travel Backpack,₹599,3.8 out of 5 stars,201,"  Care Instructions: Hand Wash Only    MADE OF DURABLE MATERIAL & SOLID : Made of Durable Nylon Fabric with metal zippers. Ensure a secure & long-lasting usage everyday & weekend. Serve you well as professional office work bag.<br><br>    WATER REPELLENT & MULTIPURPOSE : PADDED shoulder Straps offer LIGHT-WEIGHT Carrying, Perfects for business traveling, weekend getaways, shopping, professional office work and other outdoor activities. Also, a perfect college high school student backpack for Boys, girls, teens, women and men.<br><br>    FUNCTIONAL & SAFE : 2 Big Compartments to store more your belongs well and External pocket for Quick access to your basic needs like key, sun glasses and your other valuable items.<br><br>    LOTS OF STORAGE SPACE & POCKETS : One separate Notebook compartment.One spacious packing compartment roomy for daily necessities, Tech electronics accessories. With many pockets make your items organized and easier to find.<br><br>    Lining Description: Polyester; Pattern Name: Self Design; Pocket Description: Utility Pocket; Material Type: Polyester; Color Name: Navy Blue; Age Range Description: Adult; Special Features: Back Padding<br>   ",-,-,-
162,https://www.amazon.in/Storite-Travel-Bag-Lightweight-GreenPink/dp/B0B3JBYZ8C/ref=sr_1_163?crid=2M096C61O4MLT&keywords=bags&qid=1692967695&sprefix=ba%2Caps%2C283&sr=8-163,"Storite Nylon 46 Cm Multi Purpose Travel Duffle Bag for Women with Dry and Wet Separate Pocket, Lightweight Waterproof Backpack Carry Luggage Bag with Shoe Compartment (GreenPink, 46x23x25 cm)","₹1,399",4.2 out of 5 stars,382,"  Closure Type : Zip , Handle Type : Detachable    Strap Type : Two short handles + 1 Shoulder strap handle + 2 padded shoulder handle.; Item dimensions : Height : 23 cm,Width : 25 cm, Length : 46 cm , 26.45 Litrs , Water Resistant Level : Waterproof    Item Dimensions : Height : 24cm, Width : 27 cm, Lenght : 46 cm , 26.45 Litrs ,Water Resistance Level : Waterprooof.   ",-,-,-
163,https://www.amazon.in/Business-Casual-Resistant-Laptop-Backpack/dp/B0862V2GKH/ref=sr_1_164?crid=2M096C61O4MLT&keywords=bags&qid=1692967695&sprefix=ba%2Caps%2C283&sr=8-164,MI Business Casual 21L Water Resistant Laptop Backpack,₹999,4.4 out of 5 stars,1.3K+,"  Care Instructions: Hand Wash Only    21L Capacity: The Backpack has a padded laptop compartment that can fit 15.2 inch laptop. It can also accommodate essentials such as a Lunch box, Charger, Tablet, Books, Power Bank, Wallet, and Sunglass. Dimension(L*W*D): 44*32*16 cm. Material : 100% Polyester. Lining : 100% Polyster    Water Resistant Material: Advanced IPX4 coating on the material ensures resistance to water entering from any direction.    Secret/Hidden Pocket: An invisible zipper pocket on the edge of the back panel acts as a guard for any valuable items such as TWS/ Earbuds, Passport, Phone against theft.    Multi-Level Organizer: The backpack has a front zipper pocket for the ID card, Sanitizer, House keys, Pen. First compartment with pockets for the earphones, pens, notebook, Fitness Band. Spacious second compartment for all your electronics.    Ergonomic Design: Thick cushioning around the shoulders and on the back panel makes the backpack super light and comfortable on the move. “S” Shaped shoulder strap distribute the weight of the backpack across your upper body.    Made In India: Mi Business Casual Backpack is fully manufactured in India and pass through stringent quality tests and checks    6 Months Warranty: The MI Business casual backpack comes with 6 months of warranty. For queries please reach out to 18001036286   ",-,-,-
164,https://www.amazon.in/F-Gear-Spartan-Black-Laptop-Backpack/dp/B07X82WYGL/ref=sr_1_165?crid=2M096C61O4MLT&keywords=bags&qid=1692967695&sprefix=ba%2Caps%2C283&sr=8-165,F Gear Spartan 24 Ltrs Black Laptop Backpack (3179),₹658,4.0 out of 5 stars,111,"  Outer Material: Polyester, Color: Black    Water resistant    Capacity: 24 liters; Weight: 560 grams; Dimensions: 30 cms x 20 cms x 42 cms (LxWxH)    Number of Wheels: 0, Number of compartments: 2    Laptop Compatibility: Yes, Laptop Size: 15.6 inchesStrap Type: Adjustable    Warranty type: Manufacturer; 1 year manufacturer warranty is non-transferable and valid for 1 year from the original date of purchase    Extension at the back which enables it to be attached to suitcases   ",-,-,-
165,https://www.amazon.in/Genie-Heartbeat-compartments-Lightweight-Travelling/dp/B097JJFF6Z/ref=sr_1_166?crid=2M096C61O4MLT&keywords=bags&qid=1692967695&sprefix=ba%2Caps%2C283&sr=8-166,"Genie Heartbeat Backpack for Women 3 compartments, School Bags for Girls, Stylish and Trendy College Backpacks for Girls, Water Resistant and Lightweight Bags for Office and Travelling Purpose.",₹753,4.4 out of 5 stars,298,"  Made with High Quality fabric. Outer material: Nylon Twill - Soft, Durable and Water Resistant! Capacity: 27 liters, Weight: 440 g, Dimensions: 43 x 30 x 21 cm Warranty: 12 months    3 Spacious compartment: Store your Books, Stationary, Accessories, Lunch boxes, etc. It will store plenty of items. Inside Sleeve/File Holder: To keep your school supplies and important files/documents/sheets seperate Organizer: Keep every single item separately in an arranged manner, with the help of our organizer. Keep all your essentials such as wallet, ticket, cosmetics, etc. 1 side pocket: For holding water bottle, clipping pens or pencil or storing other items.    Easy grab padded handle: For added comfort and convinience to hold the bag. Padded and Ergonomic Shoulder Straps: There is padded back mesh and ergonomic straps that gives extra spine and shoulder support and helps in minimizing the load after carrying the bag through a busy day at campus.This women's backpack can be carried to work, college, school, for a day out or even while you are travelling!    Light Weight yet Durable to resist the weight of textbooks, stationary, lunch boxes. Can store all your college or office stationary, without any hassle.    Stylish & Cute: This bag is designed for those Millennials and GenZ, who aren't afraid to compromise on Utility or Fashion! It is a perfect, small bag to carry all the daily essentials while using it as a trendy accessory, or a travel bag or as a college backpack.   ",-,-,-
166,https://www.amazon.in/Arctic-Fox-Backpack-Charging-Laptop/dp/B08RS6FXYT/ref=sr_1_167?crid=2M096C61O4MLT&keywords=bags&qid=1692967695&sprefix=ba%2Caps%2C283&sr=8-167,Arctic Fox Joker Anti Theft Backpack with USB Charging Port 15 Inch Laptop Backpack,"₹1,815",4.5 out of 5 stars,270,"  This Anti-Theft Backpack apply anti-theft design technology. Zipper of main pocket is fully hidden in the back of this bag ,no theft will easily open your backpack.    USB Charge External USB port with built-in charging cable offers a convenient charging of your electronic device anywhere, and this bag do not include a battery, you need a power bank to charge it..    Spacious compartment -- Rain cover bag -- Padded shoulder straps -- N95 Mask -- Power bank port -- Water Bottle Pouch--15.5 Inch Laptop Compartment..    This Backpack is made of Water Repellent Fabric so now you can travel carefree without worrying about water splashes or rain.This Backpack comes with Arctic Fox Signature Rain Cover Bag.    Size: HxWxD : 47x29x17 CM, Capacity (Liters): 23.. It Suitable For Business, School, College, Travelling, Shopping, Trekking, Party & Other Outdoor Activities..   ",-,-,-
167,https://www.amazon.in/Gear-Classic-Leather-Backpack-LBPCLSLTH0101/dp/B07G4D13LB/ref=sr_1_168?crid=2M096C61O4MLT&keywords=bags&qid=1692967695&sprefix=ba%2Caps%2C283&sr=8-168,Gear Classic 20L Faux Leather Water Resistant Anti Theft Laptop Bag/Backpack for Men/Women-Black,₹969,4.4 out of 5 stars,2.7K+,"  Outer material: synthetic, color: black; Waterproof    Capacity: 20 liters; Weight: 560 grams; Dimensions: 48 cms x 32 cms x 14 cms (LxWxH)    Number of compartments: 2    Laptop compatibility: yes, laptop size: 16strap type: adjustable    Special Features: Back Padding; Closure Type: Zipper; Age Range Description: Adult; Pocket Description: Utility Pocket    Concealed quick access Pockets on back panel ,Adjustable Anti sweat padded Shoulder straps , Padded Laptop sleeve,2 External Pockets, Padded Back Panel Cushioned with Anti Sweat Fabric,Embedded Organizer , USB and Headphone cable slot .   ",B07G4D13LB ,Gear Merchandise PVT LTD ,womens GearMerchandisePVTLTD India LBPCLSLTH0101 B07G4D13LB 
168,https://www.amazon.in/Right-Choice-Stylish-College-Backpack/dp/B07ZVXDHCK/ref=sr_1_169?crid=2M096C61O4MLT&keywords=bags&qid=1692967695&sprefix=ba%2Caps%2C283&sr=8-169,RIGHT CHOICE quality stylish casual backpack daily use unisex typography college bags (Boys and Girls),₹315,3.5 out of 5 stars,986,  Care Instructions: Hand Wash Only    Closure Type: Zipper; Special Features: Back Padding; Subject Character: Wall-E; Age Range Description: Kid<br>; Age Range Description: Kid; Subject Character: Wall-E; Closure Type: Zipper<br><br> <br>    Strap Type: Double Handle; Water Resistance Level: Water Resistant<br><br> <br>    Material Type: Polyester; Lining Description: Polyester; Age Range Description: Baby <br>   ,-,-,-
