,Product URL,Product Name,Product Price,Rating,Reviews,Description,ASIN,Manufacturer,Product Description
42,https://www.amazon.in/Tabelito-NEO-Backpack-Business-Compartment/dp/B0C2D2Q52R/ref=sr_1_43?crid=2M096C61O4MLT&keywords=bags&qid=1692967686&sprefix=ba%2Caps%2C283&sr=8-43,"Tabelito® NEO 3O L Water Resistant Laptop/College/Office/School/Travel/Business Bag, Unisex Backpack for Men Women Fits Up to 15.6 Inch Laptop Notebook.",₹399,4.0 out of 5 stars,191,"  Care Instructions: Hand Wash Only    The front and side zipper compartments of the backpack make it simple to store items like tablets, diaries, pens, pencils, smartphones, cards, change and other small items. The backpack's side pockets make it easy to carry along tiny goods like mini umbrellas and water bottles.    MADE IN INDIA - This ""MAKE IN INDIA"" laptop bag for men has 2 front zip pockets, 2 side bottle pockets, and 1 huge zipped section. For men, women, boys, and girls, this bag works great for the office, school, and college. In fact, it's the ideal all-purpose backpack for men, school bags for girls and boys, college bags for girls and boys and workplace bags for unisex    LAPTOP BACKPACK SPECIFICATIONS - Men's NEO Laptop Backpack; Compartment Size: Up to 15.6 Inches. 30 litres is the capacity. 15 x 11.5 x 3 inches in size.    NEO padded laptop backpack with internal organiser and sleeve that can handle up to 15.6"" laptops. Compatible laptops include those made by HP, Lenovo, Acer, ASUS, and Dell. Your keys, cords, office supplies, and other valuables can be neatly organised inside the organiser to avoid theft.    The Tabelito Casual Backpack is entirely produced in India and goes through strict quality inspections and tests. Water Resistant Material: The material has an advanced IPX4 coating that prevents water from penetrating from any angle.    The backpack features a 30L capacity and a padded laptop pocket that fits a 15.6 inch laptop. Additional necessities that can fit within are a lunchbox, charger, tablet, books, power bank, wallet, and sunglasses.   ",-,-,-
43,https://www.amazon.in/Wesley-Milestone-Waterproof-Backpack-Business/dp/B085S444JV/ref=sr_1_44?crid=2M096C61O4MLT&keywords=bags&qid=1692967686&sprefix=ba%2Caps%2C283&sr=8-44,"Wesley Milestone 2.0 Casual Waterproof Laptop Backpack/Office Bag/School Bag/College Bag/Business Bag/Travel Backpack (Dimensions:13x18 inches) (Compatible with 39.62cm(15.6inch laptop) 30 L, Charcoal black",₹550,4.3 out of 5 stars,12.4K+,"  30L Capacity: The Backpack has a padded laptop compartment that can fit 15.6 inch laptop. It can also accommodate essentials such as a Lunch box, Charger, Tablet, Books, Power Bank, Wallet, and Sunglass.    Multi-Level Organizer: The backpack has a front zipper pocket for the ID card, Sanitizer, House keys, Pen. First compartment with pockets for the earphones, pens, notebook, Fitness Band. Spacious second compartment for all your electronics. Compatible Laptop Size 16 inch    Ergonomic Design: Thick cushioning around the shoulders and on the back panel makes the backpack super light and comfortable on the move. “S” Shaped shoulder strap distribute the weight of the backpack across your upper body.    Made In India: Wesley Business Casual Backpack is fully manufactured in India and pass through stringent quality tests and checks    1 Year Warranty: The Wesley Business casual backpack comes with 1 year of warranty    Water Resistant Material: Advanced IPX4 coating on the material ensures resistance to water entering from any direction.   ", B085S444JV ,"Wesley, Longani Trading Company, F-82, Sector-1, Bawana Industrial Area, Delhi-110039 ","Wesley Wesley,LonganiTradingCompany,F-82,Sector-1,BawanaIndustrialArea,Delhi-110039 MII-007 Milestone2.0 31.8x17.8x45.7cm;480Grams MII-007 LaptopCompartment,Waterproof,Lightweight,ErgonomicDesign,PaddedStrap Backpack 1 15.6Inches No Polyester Wesley India 480g "
44,https://www.amazon.in/BennettTM-Mystic-Shoulder-Messenger-Repellent/dp/B09321GJXZ/ref=sr_1_45?crid=2M096C61O4MLT&keywords=bags&qid=1692967686&sprefix=ba%2Caps%2C283&sr=8-45,Bennett™ Mystic 15.6 inch (39.6cm) Laptop Briefcase Shoulder Sling Office Business Professional Travel Messenger Bag for Men and Women Water Repellent Formal Executive Bags (Grey) 6 Months Warranty,₹512,4.0 out of 5 stars,6.4K+,"  PREMIUM QUALITY MATERIAL: This laptop computer briefcase is made of high-quality water repellent fabric, and well-made of foam pad inside. The laptop briefcase equipped with a removable shoulder strap and a soft carry handle, you can easily switch the carry way you want.    LIGHTWEIGHT AND MULTIFUNCTIONAL: It provide a removable shoulder strap, can be use as shoulder bag or handbag base on your need; top handle strap, and comes with adjustable strap with. It will be a good partner for your daily use or business trip.    EXCELLENT DETAILS: The laptop bag with exquisite zippers, durable hook of strap and soft handle, which make it more comfortable to carry and use. Ensure a secure and long-lasting usage everyday as office work bag, travel laptop briefcase, business laptop case, college laptop bag.    DIMENSION: External: 16 x 12 x 3 inch; Dimension: 16.5 x 11.5 x 2.5 inch. Suitable for 14-15.6 inch: Dell, Acer, ASUS, Samsung, HP and other brand laptops.(Please allow a little size different because of manual measurement). Great gifts choice for birthday, work anniversary.    BENNETT Warranty: Exchange within (6 months) if you don't like. If any problems, please do not hesitate to contact us. We will provide the best solution for you.   ", B09321GJXZ ,"Texcoco Enterprices, Texcoco Enterprices, 9958166528 ","Bennett TexcocoEnterprices,TexcocoEnterprices,9958166528 Mystic 30x40x2cm;499Grams Mystic Laptop LaptopCompartment,Waterproof LaptopBriefcase 1 No No Nylon TexcocoEnterprices India 499g "
45,https://www.amazon.in/AmazonBasics-Mini-Backpack-Outdoor-Black/dp/B0BRKFXT9Z/ref=sr_1_46?crid=2M096C61O4MLT&keywords=bags&qid=1692967686&sprefix=ba%2Caps%2C283&sr=8-46,AmazonBasics - Mini Backpack for Outdoor Use (12 l) (Black),₹279,3.7 out of 5 stars,623,"  Small, trendy, multipurpose backpack to use for short hikes, trips or daily use    Made from denier polyester, which is highly durable and long-lasting    Contains 1 front and 1 main compartment to store notebooks, tablets and other essentials    Comes with adjustable open angles, advanced storage design and a quick-access front pocket to carry small items    Suitable for both men and women    Capacity: 12 l    Colour: Black   ", B0BRKFXT9Z ,"IRIS TECH, IRIS TECH,G-1/G-2, Dharam complex, Phase-1, Opp.Sapna Bar, Anjur Mankoli Road, Bhiwandi-421302 ","amazonbasics IRISTECH,IRISTECH,G-1/G-2,Dharamcomplex,Phase-1,Opp.SapnaBar,AnjurMankoliRoad,Bhiwandi-421302 Backpack Black 30Centimeters 7Centimeters 43x7x30cm;113Grams AB-BP IRISTECH India 113g "
46,https://www.amazon.in/TRUE-Emperor-Anti-Theft-backpack-charging/dp/B0BYB631NR/ref=sr_1_47?crid=2M096C61O4MLT&keywords=bags&qid=1692967686&sprefix=ba%2Caps%2C283&sr=8-47,"TRUE HUMAN® Emperor Anti-Theft Pocket backpack With USB charging Port Laptop,office,college,travel bag for men and women(Epower)",₹599,3.6 out of 5 stars,268,"  Care Instructions: Wipe with Dry Cloth    PREMIUM MATERIAL: Made from high quality, Premium quality smooth zippers, pullers, buckles.    Superior & Durability: Made of durable and Eco-friendly water resistant oxford textile fabric,which keeps your files and stuffs dry inside. This backpack can hold up to 15.6"" laptop from most brands, but it may not be suitable for all brand 15.6"". Since there maybe exist slight size difference among different laptop brands.    USB FEATURE : External USB port with built-in charging cable enables convenient charging by connecting your power bank with your electronic devices.   ",-,-,-
47,https://www.amazon.in/ZIPLINE-Polyester-Backpack-Children-Daypack/dp/B07XVMR33Q/ref=sr_1_48?crid=2M096C61O4MLT&keywords=bags&qid=1692967686&sprefix=ba%2Caps%2C283&sr=8-48,Zipline Unisex casual polyester 36 L Backpack School Bag Women Men Boys Girls children Daypack College Bag Book School Sports Bag Weekend Bag,₹843,4.0 out of 5 stars,6.3K+,"  Care Instructions: Hand Wash Only    MULTI-FUNCTION COMPARTMENT: ZIPLINE backpack for men features with multiple storage compartments and for additional supplies and accessories such as your, iPhone, iPad, pen, keys, wallet, books, clothes, bottle, passport and more.    DURABLE MATERIAL: The school bag for boys is made up of superior quality which is durable, eco-friendly waterproof and anti-scratch polyester and featuring a reinforced bottom to withstand heavy use, perfect for business, travel, school and other outdoor activities.    COMFORTABLE DESIGN: Our school bag for boys ""S"" Curve is adjustable, heavily padded shoulder straps and back panel make the school bag more comfortable to wear even when loaded with all your gear; Compact: Backpack for men has a roomy three compartment, front zipper pockets to hold small accessories, one internal security zippered pocket for valuable items and side pockets for water bottle or umbrella and thus it is best school bags for boys.    Size:18*13*9 inch(L*W*H), Capacity: The college bag has capacity of 36.5L which is bigger than others of the same style. Good size for school bags, college bag, camping, travel, shopping, hiking, climbing, vintage backpack for men and women.; Age Range Description: Kid; Special Features: Water Bottle Umbrella Pouch; Pocket Description: Utility Pocket    Compartment Description: The backpack for men is not laptop compatible; Warranty Description: 1 Year From The Date Of Purchase, Water Resistance Level: Waterproof   ",-,-,-
48,https://www.amazon.in/Lavie-Sport-Duffle-Luggage-Trolley/dp/B097RJ22Q3/ref=sr_1_49?crid=2M096C61O4MLT&keywords=bags&qid=1692967687&sprefix=ba%2Caps%2C283&sr=8-49,Lavie Sport Lino Large Size 63 cms Wheel Duffle Bag for Travel | Travel Bag with Trolley,"₹1,049",4.0 out of 5 stars,8.3K+,"  The Lino wheel Duffle Bag from Lavie Sport is a voluminous yet lightweight travel duffle. Made of high quality and durable materials, it provides the same function as a large-sized suitcase.Perfect travel duffle for weekend getaways.    Built to last: This duffle bag for travel features a combi-lock, shoulder strap, fully lined interior and is built with high-quality polyester fabric for the utmost durability. Made from water repellent & premium zippers, it makes it a super durable and lightweight all-weather travel duffle bag.    Plenty of Space & Easy to carry: The front side features a zippered pocket that is perfect to store quick access essentials. Lino luggage bags for travel have sturdy heavy-duty treaded rubber wheels in a protective wheel housing and retractable trolley for smooth mobility and maximum durability.    External Dimension: Length – 63cm, Width – 30cm, Height – 32cm, Capacity - 60 Litres.    Manufacturer warranty - 2 years   ",-,-,-
49,https://www.amazon.in/STRABO-Cooper-Laptop-Bag-Capacity/dp/B0BX9SVT1D/ref=sr_1_50?crid=2M096C61O4MLT&keywords=bags&qid=1692967687&sprefix=ba%2Caps%2C283&sr=8-50,"STRABO Cooper for Boys Girls Stylish Men and Women Casual 15"" inch 25L CANVAS Laptop BACKPACK | Office, College, Travel Bag",₹789,4.3 out of 5 stars,70,  Care Instructions: Hand Wash Only    One Main compartment and Laptop Compartment with front pocket & 2 side bottle sleeves    Dimensions 45 x 32 x 17 cm    Capacity 20L    Premium YKK zippers   ,-,-,-
50,https://www.amazon.in/Genie-Miami-litres-Casual-Backpack/dp/B07SRGGGNC/ref=sr_1_51?crid=2M096C61O4MLT&keywords=bags&qid=1692967687&sprefix=ba%2Caps%2C283&sr=8-51,"Genie Miami Laptop Backpack for Women,Tuition bag, 16 inches Office Bag, Sky Blue Stylish and Trendy Bag for Office and College",₹803,4.2 out of 5 stars,1.4K+,"  Outer Material : Nylon, Color: Pink, Water Resistant    Dimensions: 29.5x41.5x14.5 cm (LxWxH), Capacity: 18 Litres, Number of compartments: 1, Laptop Compatibility: Yes, Laptop Size: 15.6 inch    Warranty: 12 months manufacturer warranty, Weight: 405 gms    Quick Access Front Pocket, One side Pocket, Fully Lined    Feather Light   ",-,-,-
51,https://www.amazon.in/Lunars-Bingo-Laptop-Resistant-48L/dp/B08YZ8FFBZ/ref=sr_1_52?crid=2M096C61O4MLT&keywords=bags&qid=1692967687&sprefix=ba%2Caps%2C283&sr=8-52,Lunar's Bingo - 48 L Laptop Office/School/Travel/Business Backpack Water Resistant - Fits Up to 15.6 Inch Laptop Notebook with 1 Year Warranty,₹819,3.9 out of 5 stars,10.1K+,"  MADE IN INDIA - This “MAKE IN INDIA” Laptop bag for men features 3 large zippered compartments, 1 zip pocket at front, 2 side bottle pockets. This is a perfect laptop, office, school, college bag for men, women, boys and girls. In deed a perfect all-rounder backpack for men, school bags for boys and girls, College bag for boys and college bag for girls, office bag for men and women.    LAPTOP BAG FEATURES - Compartment Description: Up To 15 Inches; Style Name: Casual Backpack for men. Capacity: 48 liters. Size: 20 inch X 13.5 inch X 9.5 inch.    WATER RESISTANT – This laptop bag for men is stylish and durable unisex travel laptop backpack that is your perfect travel partner. School bags for boys is made of high-grade water-resistant polyester material that gives it strength and durable for long-term use. 12 months warranty for any manufacturing defects.    PADDED LAPTOP SLEEVE AND INTERNAL ORGANISER : Padded Laptop backpack for men has sleeve with holder to secure upto 15.6"" Laptops. This office bag for men is compatible with laptops like HP / Lenovo / Acer / ASUS / Dell. Internal organiser to neatly organise and store your keys, cables, stationary and other valuables from theft.    1 YEAR WARRANTY - We offer 1 Year warranty for any manufacturing defects; BEST BACK SUPPORT - We have designed this laptop bag for men to keep your comfort in mind. Shoulder has 12MM high density padding, with 3D ventilated air foam padding to prevent sweating when you use the bag; Pattern Name: Solid; Age Range Description: Adult; Color Name: Black; Special Features: Laptop Compartment; Pattern Name: Solid; Age Range Description: Adult   ",-,-,-
52,https://www.amazon.in/Nelle-Harper-Womens-Sling-Green/dp/B07JGQM7DC/ref=sr_1_53?crid=2M096C61O4MLT&keywords=bags&qid=1692967687&sprefix=ba%2Caps%2C283&sr=8-53,Nelle Harper Women's Handbag,₹959,3.6 out of 5 stars,1.9K+,"  Style meets functionality with this well crafted sling along with attractive gold hardware giving it a classy vintage look    The inner magnetic closure compartments, and zipper pockets converts the bag into your efficiency partner for your A-game    Club it with your evening dress or sling it along for that satisfying shopping spree    Made in India   ",-,-,-
53,https://www.amazon.in/Gear-Beige-Casual-Backpack-BKPTRMP520522/dp/B00VWM11HQ/ref=sr_1_54?crid=2M096C61O4MLT&keywords=bags&qid=1692967687&sprefix=ba%2Caps%2C283&sr=8-54,Gear Triumph Summer Print 26L Water Resistant Backpack with Rain Cover/School Bag/College Bag/Daypack/Casual Backack for Girls/Women (Blue-Beige),₹699,4.2 out of 5 stars,5.7K+,"  Outer Material: Polyester, Inner Material: Polyester, Color: Navy Blue and Beige; Anti-sweat fabric on inner-side of shoulder straps    Wear Resistant: Wearproof, Water Resistance: waterproofDimensions: 32 cms x 18 cms x 47 cms (LxWxH)    Capacity: 26 liters, Weight: 0.534 Kg    Number of compartments: 3; Strap Type: Adjustable    Age Range Description: Adult; Pocket Description: Utility Pocket; Style Name: Traditional Backpacks; Closure Type: Zipper; Special Features: Back Padding   ",-,-,-
54,https://www.amazon.in/AUXTER-BLACKY-Duffel-Emboss-Black/dp/B07F2H25NP/ref=sr_1_55?crid=2M096C61O4MLT&keywords=bags&qid=1692967687&sprefix=ba%2Caps%2C283&sr=8-55,AUXTER Faux Leather 23 Cms Duffle Bag(AUX_GB_LE_Black -SE__0521_Black),₹429,4.3 out of 5 stars,9.3K+,"  Material / Dimension : Outer Material - Premium leatherette Fabric, Inner Material – Soft Polyester, Size: 43 cm x 23 cm x 23 cm. (L x B x H), Color : Black    Capacity: 23 Liters, 1 Large Double Zip Closure Compartment, 1 external Mesh Organizer Pocket for the earphones, ID card, Sanitizer, House keys, Fitness Band. 1 Main Compartment for all your Gym Clothes, Gym belt, towel, Gym gloves, shaker, shoe Pair etc.    Design: Design with Self Embossed logo On the Premium Leatherette Heavy Quality Material. 3.8 Cm Wide and 125 cm Long Adjustable Handle and Double side easy carry handle.    Manufacturing & Warranty: This Product is made in INDIA By “The INDIAN KARIGAR “ and pass though the many quality checks and tests This Product is come With 1 year of Warranty.    Suitable: Auxter Black Gym Bag/ Duffel bag is suitable for gym, Day trip bag, casual round bag, travel bag is suitable for men women boys and Girls. This Bag is trending For Gift Purpose   ",-,-,-
55,https://www.amazon.in/Nivia-Deflate-5180BK-Polyester-Round/dp/B07222KX3S/ref=sr_1_56?crid=2M096C61O4MLT&keywords=bags&qid=1692967687&sprefix=ba%2Caps%2C283&sr=8-56,NIVIA Deflate Round 01 Polyester Gym Bag/Unisex Gym Bags/Adjustable Shoulder Bag for Men/Duffle Gym Bags for Men/Carry Gym Accessories/Fitness Bag/Sports &Travel Bag/Gym kit Bag (Black),₹461,4.2 out of 5 stars,7.5K+,"  Strong stitching at major stress points provide long-lasting durability against daily activities    Main compartment with zip closure    Lightweight and fold-able, It's easy to fold up into small compact space.    Can be folded and inserted in the inner pocket with double sided runner    Optimum quality of accessories and zipper for smoother functioning and high durability    Bag Capacity - 19.5 Ltrs   ",B07222KX3S ,Freewill Sports Private Limited ,Unisex-Adult FreewillSportsPrivateLimited India 5180BK B07222KX3S 
56,https://www.amazon.in/Red-Lemon-Backpack-Accessories-Organiser/dp/B0C2KRH268/ref=sr_1_57?crid=2M096C61O4MLT&keywords=bags&qid=1692967687&sprefix=ba%2Caps%2C283&sr=8-57,"Red Lemon Swiss Cut Design 15.6 Inch Smart Laptop Backpack Bag With USB Charging Port, Anti Theft Pocket and Accessories Organiser for Men Women Boys Girls","₹1,799",4.3 out of 5 stars,1.1K+,"  PREMIUM MATERIAL: This multifunctional bag is made of quality Water Repellent polyester material in black color to protect your goods from water. For the inner lining, soft feel premium polyester is used. The hardware such as strengthened hooks, zippers and buckles used are wear resistant, smooth, and durable.    LARGE CAPACITY : Comes with 2 compartments with one separate cushioned laptop sleeve to hold 15. 6 inch Laptop. Additional front zipper pockets with an organiser to store magazine, pens, key,music, cosmetic, pen, charger, powerbank, cable etc. Side pockets for water bottles,umbrella. Back hidden anti theft pocket can hold your wallet,phone,etc    TROLLEY STRAP & CONVENIENCE : The insertible pull rod box design allows the bag to slide over the luggage handle for easy mobility during traveling. Comfortable airflow back ergonomics design with soft padding, gives you maximum back support. Breathable and adjustable shoulder straps relieve the stress of shoulder. Foam padded top handle for a long time carry on.    ONE YEAR WARRANTY: 1-year warranty on this bag against any manufacturing defects. Just keep your documents safe. Contact Red Lemon for any issues regarding the product and a resolution will be provided.   ",-,-,-
57,https://www.amazon.in/Backpack-Business-Scratch-resistant-Multiple-Comfortable/dp/B0B6FNPN76/ref=sr_1_58?crid=2M096C61O4MLT&keywords=bags&qid=1692967687&sprefix=ba%2Caps%2C283&sr=8-58,Arctic Hunter Backpack for Men Premium Business Backpack Office Travel Laptop Bag with 15.6 Inch Laptop Pocket Water/Scratch-resistant Multiple Pocket Comfortable and Padded Backpack for Men,"₹5,699",4.4 out of 5 stars,180,"  Care Instructions: Wipe with Damp Cloth    [Multiple Pocket] -- Arctic Hunter original bag,100% guarantee,two-year warranty.6 zipper pockets store your items.2 front pockets+1 main pocket+1 laptop compartment+2 side pockets.the two front zipper pockets can store small and frequently used items.the main pocket is used for storing cloth,built in a X bucket to hold your clothing and an anti-theft zipper pocket.the laptop compartments have a 15.6 laptop pocket+a ipad pocket,the two pocket is very thick to protect your laptop and ipad.    [High quality premium business backpack]-- The Main body of this backpack made by 1680D Nylon fabric,so it's outstanding durable and breathable.the inside made by hiking bag polyester,which make it's abrasion and scratch resistant.the all zipper head is made of high quality metal.laptop and ipad pockets made by high-density foam for shockproof.these material make sure you can use it for a long time and can be a premium business backpack for you.    [Ergonomic travel bag]-- This backpack adopts with Ergonomic+Comfortable design.1) Microfiber Leather handle make you comfortable hold this backpack.2) The running shoe material back pad is more breathable.3) Strap that secure this backpack to the trolley trunk can free your hands and back.4) Water resistant material protect your items.5) The shoulder strap is thickness and made of running shoe material.6) Made by high quality material make sure load large weight for a long time.    [Outstanding backpack for laptop]--This arctic hunter bag have a different design,have a zipper compartment for laptop and ipad.this compartment built-in high-density foam to outstanding protect your laptop/ipad.and it can put into 2 laptops.this laptop compartment is not at main compartment,which make the main compartment store more clothing.so this design is very nice and More suitable as a laptop bag.    [Great value for money]-- This arctic hunter backpack is very nice for travel,business,school.this meterial and production exceed this price.don't worry it is not worth and it is a great present for birthday,Valentine's day,Father's day,Diwali,Christmas,The New Year.   ",-,-,-
58,https://www.amazon.in/Skybags-Unisex-Gucci-Fabric-Backpacks/dp/B0B21XCFRM/ref=sr_1_59?crid=2M096C61O4MLT&keywords=bags&qid=1692967687&sprefix=ba%2Caps%2C283&sr=8-59,Skybags Unisex Gucci Fabric Backpacks,₹799,3.9 out of 5 stars,408,  Care Instructions: Hand Wash Only    A super sleek and casual 27L backpack. Ideal for college student or a day tour. Big enough to carry all your essentials. Sleek enough to carry it with ease   ,-,-,-
59,https://www.amazon.in/ADISA-Womens-Girls-Party-Crossbody/dp/B0B2WBJ2H8/ref=sr_1_60?crid=2M096C61O4MLT&keywords=bags&qid=1692967687&sprefix=ba%2Caps%2C283&sr=8-60,ADISA Women's Girls Party Sling Bag Crossbody,₹394,4.0 out of 5 stars,617,"  Outer Material: PU / Synthetic Leather    Closure: Magnetic    Pockets: 1, Compartments: 1    Height Adjustable Sling belt    Dimensions: LxWxH - 7.25 x 2.1 x 6 inches   ",-,-,-
60,https://www.amazon.in/Wildcraft-Wolf_Blk-Casual-Backpack-11629-Wolf_Blk/dp/B079DDT65R/ref=sr_1_61?crid=2M096C61O4MLT&keywords=bags&qid=1692967687&sprefix=ba%2Caps%2C283&sr=8-61,Wildcraft Nylon 44 Ltrs Casual Backpack (11629-Wolf_Black),"₹1,749",4.3 out of 5 stars,5.8K+,"  Care Instructions: Hand Wash Only    Number of compartments: 3, Laptop Sleeve: Yes   ",-,-,-
61,https://www.amazon.in/Safari-Sheild-Resistant-Casual-Backpack/dp/B09B28M2RN/ref=sr_1_62?crid=2M096C61O4MLT&keywords=bags&qid=1692967687&sprefix=ba%2Caps%2C283&sr=8-62,Safari Sheild 26 Ltrs Water Resistant Casual Backpack - (SHEILD19CBBLK),₹709,4.0 out of 5 stars,563,"  100% Polyester, High Quality, Durable and Water Resistant Fabric    Front storage pocket keeps smaller items neatly organized and easy to access    Mesh pockets on both sides to accommodate your water bottle and umbrella    Mesh Padding on back & shoulder strap to provide comfort & better back support; 1-year International Warranty against manufacturing defects    Age Range Description: Adult; Closure Type: Zipper; Special Features: Lightweight   ",-,-,-
62,https://www.amazon.in/Nivia-5183-Polyester-Duffle-Medium/dp/B071KNXQ7Y/ref=sr_1_63?crid=2M096C61O4MLT&keywords=bags&qid=1692967687&sprefix=ba%2Caps%2C283&sr=8-63,NIVIA Beast Gym Bag-4 Polyester/Unisex Gym Bags/Shoulder Bag for Men & Women with Separate Shoes Compartment/Carry Gym Accessories/Fitness Bag/Sports & Travel Bag/Sports Kit,₹503,4.2 out of 5 stars,3.5K+,  Highly water-resistant finish to save inner items from water splashes    Adjustable shoulder strap    Top grab handle    Optimum quality of accessories and zipper for smoother functioning and high durability    Durable zippers and enhanced by strong stitching at major stress points provide long-lasting durability against daily activities   , B071KNXQ7Y ,Freewill Sports Private Limited ,Adult No NIVIA--StepOut&Play Black WebHandle Bags Polyester Polyester All M Exercise&Fitness Old FreewillSportsPrivateLimited India 
63,https://www.amazon.in/ADISA-Laptop-Backpack-Office-College/dp/B0BPVCBFM7/ref=sr_1_64?crid=2M096C61O4MLT&keywords=bags&qid=1692967687&sprefix=ba%2Caps%2C283&sr=8-64,ADISA 32L large laptop backpack office bag college travel back pack with rain cover,₹599,3.8 out of 5 stars,325,  Material: Water Resistant Strong Polyester    Compartments: 2 with padding    Laptop Size: 15.6 inch and below    Dimensions: LxWxH - 11 x 6 x 18 inches    Reflector Logo / Adjustable Padded Shoulder Straps / 2 Bottle holders / Padded Top Handle / Rain Cover   ,-,-,-
